83,Prosiect Net Zero Gwynedd,Gwynedd Council,LL55 1SH,,"Project by Adra (Tai) Cyfyngedig to encourage and support energy conservation and the adoption of net zero technologies in local communities through advocacy, demonstrators, skills development and research.",,,"£600,987 ",1,#N/A,#N/A,2,3,23,3,,,,,,,,,,,,,,,,,,,,,,"£600,987 ",,,,,,,,,,,,,,,,,,,,,,,,,,,,,,,,,,,,,,,,,,,,,,,,,,,,,,,,,,,,,,,,,,,,,,,,,,,,,,,,,,,,,,,,,,,,,,,,,,,,,,,,,,,,,,,,,,,,,,,,,,,,,,,,,,,,,,,,,,,,,,,,,,,,,,,,,,,,,,,,,,,,,,,,,,,,,,,,,,,,,,,
84,Sesiwn Fawr Development Project,Gwynedd Council,LL55 1SH,,Project by Sesiwn Fawr Dolgellau to extend the provision of the annual festival beyond one weekend a year and across Meirionnydd by undertaking a feasibility study with the intention of developing skills in the arts and entertainment facilities in the area.,,,"£45,900 ",1,#N/A,#N/A,2,2,23,3,,,,,,,,,,,,,,,,,,,,,,"£45,900 ",,,,,,,,,,,,,,,,,,,,,,,,,,,,,,,,,,,,,,,,,,,,,,,,,,,,,,,,,,,,,,,,,,,,,,,,,,,,,,,,,,,,,,,,,,,,,,,,,,,,,,,,,,,,,,,,,,,,,,,,,,,,,,,,,,,,,,,,,,,,,,,,,,,,,,,,,,,,,,,,,,,,,,,,,,,,,,,,,,,,,,,
85,Team Around the Young Person,Gwynedd Council,LL55 1SH,,Project by GISDA to trial various interventions and support with vulnerable young people with the aim of preparing for a long-term multi-agency plan to work holistically with them.,,,"£387,600 ",1,#N/A,#N/A,2,2,23,3,,,,,,,,,,,,,,,,,,,,,,"£387,600 ",,,,,,,,,,,,,,,,,,,,,,,,,,,,,,,,,,,,,,,,,,,,,,,,,,,,,,,,,,,,,,,,,,,,,,,,,,,,,,,,,,,,,,,,,,,,,,,,,,,,,,,,,,,,,,,,,,,,,,,,,,,,,,,,,,,,,,,,,,,,,,,,,,,,,,,,,,,,,,,,,,,,,,,,,,,,,,,,,,,,,,,
86,Training and experience in the outdoor sector in Gwynedd.,Gwynedd Council,LL55 1SH,,Project by Urdd Gobaith Cymru at the Glan-llyn Centre to promote skills and experience in the outdoor sector.  This will be achieved by training more outdoor activity practitioners through the medium of Welsh in response to the skills gap in the sector.,,,"£512,420 ",1,#N/A,#N/A,2,2,23,3,,,,,,,,,,,,,,,,,,,,,,"£512,420 ",,,,,,,,,,,,,,,,,,,,,,,,,,,,,,,,,,,,,,,,,,,,,,,,,,,,,,,,,,,,,,,,,,,,,,,,,,,,,,,,,,,,,,,,,,,,,,,,,,,,,,,,,,,,,,,,,,,,,,,,,,,,,,,,,,,,,,,,,,,,,,,,,,,,,,,,,,,,,,,,,,,,,,,,,,,,,,,,,,,,,,,
87,Adfywio Mon Renewal Programme,Isle of Anglesey County Council,LL77 7TW,,Projects to improve and make better use of heritage assets as drivers of regeneration and sustainable tourism; to support and increase the level of woodland and tree cover; to support and increase Green Infrastructure provision and planning; to support and increase the use of the Welsh language at a community level.,,,"£591,600 ",1,#N/A,#N/A,2,3,21,1,,,,,,,,,,,,,,,,,,,,,,"£591,600 ",,,,,,,,,,,,,,,,,,,,,,,,,,,,,,,,,,,,,,,,,,,,,,,,,,,,,,,,,,,,,,,,,,,,,,,,,,,,,,,,,,,,,,,,,,,,,,,,,,,,,,,,,,,,,,,,,,,,,,,,,,,,,,,,,,,,,,,,,,,,,,,,,,,,,,,,,,,,,,,,,,,,,,,,,,,,,,,,,,,,,,,
88,Cefnogi Busnesau MÃ´n,Isle of Anglesey County Council,LL77 7TW,,"Supporting the hardest to reach businesses and entrepreneurs that do not normally engage with new business start-up support, business development & growth support post Covid-19.",,,"£217,062 ",1,#N/A,#N/A,2,2,23,1,,,,,,,,,,,,,,,,,,,,,,"£217,062 ",,,,,,,,,,,,,,,,,,,,,,,,,,,,,,,,,,,,,,,,,,,,,,,,,,,,,,,,,,,,,,,,,,,,,,,,,,,,,,,,,,,,,,,,,,,,,,,,,,,,,,,,,,,,,,,,,,,,,,,,,,,,,,,,,,,,,,,,,,,,,,,,,,,,,,,,,,,,,,,,,,,,,,,,,,,,,,,,,,,,,,,
89,Feasibility Study of a multi-vector Smart Local Energy System in Isle of Anglesey County,Isle of Anglesey County Council,LL77 7TW,,To assess the feasibility of multi-vector Smart Local Energy Schemes for the local authority area. The recommendations resulting from the feasibility study and delivery plan will form part of the business case development process for the Growth Deal's Smart Local Energy Project.,,,"£96,900 ",1,#N/A,#N/A,2,2,23,1,,,,,,,,,,,,,,,,,,,,,,"£96,900 ",,,,,,,,,,,,,,,,,,,,,,,,,,,,,,,,,,,,,,,,,,,,,,,,,,,,,,,,,,,,,,,,,,,,,,,,,,,,,,,,,,,,,,,,,,,,,,,,,,,,,,,,,,,,,,,,,,,,,,,,,,,,,,,,,,,,,,,,,,,,,,,,,,,,,,,,,,,,,,,,,,,,,,,,,,,,,,,,,,,,,,,
90,Innovation Island,Isle of Anglesey County Council,LL77 7TW,,"Supporting new opportunities in science and technology including digital skills, a skills incubator, business boot-camps, developing young enterprise, digital and net zero business support and supporting an offshore energy cluster.  It will also generate at least 14 new direct jobs.",,,"£924,017 ",1,#N/A,#N/A,2,3,23,1,,,,,,,,,,,,,,,,,,,,,,"£924,017 ",,,,,,,,,,,,,,,,,,,,,,,,,,,,,,,,,,,,,,,,,,,,,,,,,,,,,,,,,,,,,,,,,,,,,,,,,,,,,,,,,,,,,,,,,,,,,,,,,,,,,,,,,,,,,,,,,,,,,,,,,,,,,,,,,,,,,,,,,,,,,,,,,,,,,,,,,,,,,,,,,,,,,,,,,,,,,,,,,,,,,,,
91,MÃ´n Ymlaen,Isle of Anglesey County Council,LL77 7TW,,A collaboration between Ynys Môn County Council Youth Services and Môn CF to work with hard to reach young people to help them get into work.,,,"£372,666 ",1,#N/A,#N/A,2,2,23,1,,,,,,,,,,,,,,,,,,,,,,"£372,666 ",,,,,,,,,,,,,,,,,,,,,,,,,,,,,,,,,,,,,,,,,,,,,,,,,,,,,,,,,,,,,,,,,,,,,,,,,,,,,,,,,,,,,,,,,,,,,,,,,,,,,,,,,,,,,,,,,,,,,,,,,,,,,,,,,,,,,,,,,,,,,,,,,,,,,,,,,,,,,,,,,,,,,,,,,,,,,,,,,,,,,,,
92,Providing high quality Level 4 Health and Social Care Education in North Wales,Isle of Anglesey County Council,LL77 7TW,,Training people in the sector to meet a local skills gap and enhance their own development opportunities.,,,"£517,915 ",1,#N/A,#N/A,2,3,23,1,,,,,,,,,,,,,,,,,,,,,,"£517,915 ",,,,,,,,,,,,,,,,,,,,,,,,,,,,,,,,,,,,,,,,,,,,,,,,,,,,,,,,,,,,,,,,,,,,,,,,,,,,,,,,,,,,,,,,,,,,,,,,,,,,,,,,,,,,,,,,,,,,,,,,,,,,,,,,,,,,,,,,,,,,,,,,,,,,,,,,,,,,,,,,,,,,,,,,,,,,,,,,,,,,,,,
93,Creative Industry Training Programme,Merthyr Tydfil County Borough Council,CF47 8AN,,"Provide a collaborative way of working, supporting training and learning opportunities in venues across Merthyr Tydfil and Cardiff.",,,"£1,027,119 ",1,#N/A,#N/A,2,3,23,15,21,,,,,,,,,,,,,,,,,,,,,"£513,559 ","£513,559 ",,,,,,,,,,,,,,,,,,,,,,,,,,,,,,,,,,,,,,,,,,,,,,,,,,,,,,,,,,,,,,,,,,,,,,,,,,,,,,,,,,,,,,,,,,,,,,,,,,,,,,,,,,,,,,,,,,,,,,,,,,,,,,,,,,,,,,,,,,,,,,,,,,,,,,,,,,,,,,,,,,,,,,,,,,,,,,,,,,,,,,
94,Encouraging Enterprise,Merthyr Tydfil County Borough Council,CF47 8AN,,Enterprise advice service run by Merthyr Tydfil local authority,,,"£555,170 ",1,#N/A,#N/A,2,2,23,15,,,,,,,,,,,,,,,,,,,,,,"£555,170 ",,,,,,,,,,,,,,,,,,,,,,,,,,,,,,,,,,,,,,,,,,,,,,,,,,,,,,,,,,,,,,,,,,,,,,,,,,,,,,,,,,,,,,,,,,,,,,,,,,,,,,,,,,,,,,,,,,,,,,,,,,,,,,,,,,,,,,,,,,,,,,,,,,,,,,,,,,,,,,,,,,,,,,,,,,,,,,,,,,,,,,,
95,H FACTOR Carbon Economy College (CEC),Merthyr Tydfil County Borough Council,CF47 8AN,,"The project will focus on 50 funded work placements of up to 20 weeks in renewable energy, and land management, working with small businesses in the area to promote growth in the renewable energy field. It will create a supply of skilled workforce in an area of growth currently facing a vast skills shortage, both locally and nationally. ",,,"£218,360 ",1,#N/A,#N/A,2,2,23,15,,,,,,,,,,,,,,,,,,,,,,"£218,360 ",,,,,,,,,,,,,,,,,,,,,,,,,,,,,,,,,,,,,,,,,,,,,,,,,,,,,,,,,,,,,,,,,,,,,,,,,,,,,,,,,,,,,,,,,,,,,,,,,,,,,,,,,,,,,,,,,,,,,,,,,,,,,,,,,,,,,,,,,,,,,,,,,,,,,,,,,,,,,,,,,,,,,,,,,,,,,,,,,,,,,,,Assume only Merthyr
96,Merthyr's Roots - a living landscape,Merthyr Tydfil County Borough Council,CF47 8AN,,"Merthyr’s Roots Project will raise awareness of and encourage greater, sustainable use and healthy exploration of the wonderful local heritage assets (both natural and cultural). This pilot project has two distinctive yet complementary elements, a garden/hub and an education/training service, which together can be used as tools to reintroduce schools, communities and stakeholders to their local heritage landscapes and help local people become better global citizens. ",,,"£173,135 ",1,#N/A,#N/A,2,3,23,15,,,,,,,,,,,,,,,,,,,,,,"£173,135 ",,,,,,,,,,,,,,,,,,,,,,,,,,,,,,,,,,,,,,,,,,,,,,,,,,,,,,,,,,,,,,,,,,,,,,,,,,,,,,,,,,,,,,,,,,,,,,,,,,,,,,,,,,,,,,,,,,,,,,,,,,,,,,,,,,,,,,,,,,,,,,,,,,,,,,,,,,,,,,,,,,,,,,,,,,,,,,,,,,,,,,,
97,Caldicot Community Partnership,Monmouthshire County Council,NP15 1GA,,"Revenue funding for ‘Together Works’, the Wellbeing Workshop and Community Hub in Caldicot, offering people free access to equipment that supports carpentry, product design, plastic recycling, engineering and art.  The project will support spaces for community activities, training, an outdoor meeting area and community kitchen.   ",,,"£82,309 ",1,#N/A,#N/A,3,3,21,,,,,,,,,,,,,,,,,,,,,,,,,,,,,,,,,,,,,,,,,,,,,Caldicot,,,,,,,,,,,,,,,,,,,,,,,,,,,,,,,,,,,,,,,,,,,,,,,,,,NP26 5,,,,,,,,,,,,,,,,,,,,,,,,,,,,,,,,,,,,,,,,,,,,,,,,,,82309,,,,,,,,,,,,,,,,,,,,,,,,,,,,,,,,,,,,,,,,,,,,,,,,,,,,,,,,,,,,,
98,Carbon Free Future,Monmouthshire County Council,NP15 1GA,,"A cooperation to investigate retrofitting  housing stock to improve Energy Performances Certificate ratings, ensuring that correct apprenticeships are in place to cover a wide range of current and future skills requirements.  ",,,"£136,680 ",1,#N/A,#N/A,2,3,21,19,,,,,,,,,,,,,,,,,,,,,,"£136,680 ",,,,,,,,,,,,,,,,,,,,,,,,,,,,,,,,,,,,,,,,,,,,,,,,,,,,,,,,,,,,,,,,,,,,,,,,,,,,,,,,,,,,,,,,,,,,,,,,,,,,,,,,,,,,,,,,,,,,,,,,,,,,,,,,,,,,,,,,,,,,,,,,,,,,,,,,,,,,,,,,,,,,,,,,,,,,,,,,,,,,,,,
99,Digital Customer Acquisition: Moving the Needle,Monmouthshire County Council,NP15 1GA,,"A cutting-edge, bespoke package of training and mentoring in digital customer acquisition and retention, focused on micro and small businesses.  The programme has the ability to ‘move the needle’ for the entire economy from an organic farmer to a high street retailer to a biotech company.  The programme will have a direct positive impact on an organisation’s ability to market and sell their products and services locally, nationally and internationally.    ",,,"£606,334 ",1,#N/A,#N/A,2,2,21,19,,,,,,,,,,,,,,,,,,,,,,"£606,334 ",,,,,,,,,,,,,,,,,,,,,,,,,,,,,,,,,,,,,,,,,,,,,,,,,,,,,,,,,,,,,,,,,,,,,,,,,,,,,,,,,,,,,,,,,,,,,,,,,,,,,,,,,,,,,,,,,,,,,,,,,,,,,,,,,,,,,,,,,,,,,,,,,,,,,,,,,,,,,,,,,,,,,,,,,,,,,,,,,,,,,,,
100,iConnect,Monmouthshire County Council,NP15 1GA,,"A place-based pilot in Monmouth, Abergavenny and Caldicot to bring affordable, fast, and accessible digital infrastructure to tenants who have no digital footprint or are in digital poverty.",,,"£122,611 ",1,#N/A,#N/A,2,2,21,19,,,,,,,,,,,,,,,,,,,,,,"£122,611 ",,,,,,,,,,,,,,,,,,,,,,,,,,,,,,,,,,,,,,,,,,,,,,,,,,,,,,,,,,,,,,,,,,,,,,,,,,,,,,,,,,,,,,,,,,,,,,,,,,,,,,,,,,,,,,,,,,,,,,,,,,,,,,,,,,,,,,,,,,,,,,,,,,,,,,,,,,,,,,,,,,,,,,,,,,,,,,,,,,,,,,,
101,Space for Local Production - SFLP,Monmouthshire County Council,NP15 1GA,,"A collaboration with the Sustainable Food Trust, Natural Resources Wales, Astario Systems, Wye and Usk Foundation, Farming Connect and Dŵr Cymru Welsh Water.  The project will pilot the on-farm sustainability tool ‘Global Farm Metric’. ",,,"£167,063 ",1,#N/A,#N/A,2,2,21,19,,,,,,,,,,,,,,,,,,,,,,"£167,063 ",,,,,,,,,,,,,,,,,,,,,,,,,,,,,,,,,,,,,,,,,,,,,,,,,,,,,,,,,,,,,,,,,,,,,,,,,,,,,,,,,,,,,,,,,,,,,,,,,,,,,,,,,,,,,,,,,,,,,,,,,,,,,,,,,,,,,,,,,,,,,,,,,,,,,,,,,,,,,,,,,,,,,,,,,,,,,,,,,,,,,,,Assume county wide
102,The Future is Us - young people have their say,Monmouthshire County Council,NP15 1GA,,"A youth arts project delivered through partnership and consortium working, putting young people at the centre of its development and design.   The project promotes ownership of individual opinions/views and shared creativity.  Identifying workable and sustainable mechanisms acceptable to young people to help them build their skills. ",,,"£168,491 ",1,#N/A,#N/A,2,3,21,19,,,,,,,,,,,,,,,,,,,,,,"£168,491 ",,,,,,,,,,,,,,,,,,,,,,,,,,,,,,,,,,,,,,,,,,,,,,,,,,,,,,,,,,,,,,,,,,,,,,,,,,,,,,,,,,,,,,,,,,,,,,,,,,,,,,,,,,,,,,,,,,,,,,,,,,,,,,,,,,,,,,,,,,,,,,,,,,,,,,,,,,,,,,,,,,,,,,,,,,,,,,,,,,,,,,,
103,The Zero Carbon Llanarth Village Plan,Monmouthshire County Council,NP15 1GA,,To investigate the most appropriate energy loss interventions in the social houses in and around the village.   To investigate potential renewable energy sources for each property and renewable energy solutions in and around the village.  To share these findings with organisations intent on looking at zero carbon housing schemes. ,,,"£122,400 ",1,#N/A,#N/A,3,3,21,,,,,,,,,,,,,,,,,,,,,,,,,,,,,,,,,,,,,,,,,,,,,Llanarth,Llanarth,Llanarth,,,,,,,,,,,,,,,,,,,,,,,,,,,,,,,,,,,,,,,,,,,,,,,,NP15 2,NP15 1,NP16 6,,,,,,,,,,,,,,,,,,,,,,,,,,,,,,,,,,,,,,,,,,,,,,,,40800,40800,40800,,,,,,,,,,,,,,,,,,,,,,,,,,,,,,,,,,,,,,,,,,,,,,,,,,,,,,,,,,,
104,Transforming MonLife's Major Assets,Monmouthshire County Council,NP15 1GA,,"Project to deepen community involvement, reach new audiences, improve the experience, and promote sustainability and regeneration to help preserve Mon Life’s important local assets and enhance accessibility and future opportunities. ",,,"£467,620 ",1,#N/A,#N/A,2,3,21,19,,,,,,,,,,,,,,,,,,,,,,"£467,620 ",,,,,,,,,,,,,,,,,,,,,,,,,,,,,,,,,,,,,,,,,,,,,,,,,,,,,,,,,,,,,,,,,,,,,,,,,,,,,,,,,,,,,,,,,,,,,,,,,,,,,,,,,,,,,,,,,,,,,,,,,,,,,,,,,,,,,,,,,,,,,,,,,,,,,,,,,,,,,,,,,,,,,,,,,,,,,,,,,,,,,,,Specific local sites but there are many spread across the county
105,Wye Valley River Festival CIC Growing Community Interests,Monmouthshire County Council,NP15 1GA,,"Project to span Monmouthshire and borders, providing crucial access to creative resources, personal development training, enhanced employment opportunities and live cultural experiences to those living in rurally deprived areas.  ",,,"£169,848 ",1,#N/A,#N/A,2,3,21,19,,,,,,,,,,,,,,,,,,,,,,"£169,848 ",,,,,,,,,,,,,,,,,,,,,,,,,,,,,,,,,,,,,,,,,,,,,,,,,,,,,,,,,,,,,,,,,,,,,,,,,,,,,,,,,,,,,,,,,,,,,,,,,,,,,,,,,,,,,,,,,,,,,,,,,,,,,,,,,,,,,,,,,,,,,,,,,,,,,,,,,,,,,,,,,,,,,,,,,,,,,,,,,,,,,,,
106,"A roadmap for restoring, enhancing and connecting Green Infrastructure for people and nature in a post-industrial landscape",Neath Port Talbot Council,SA13 1PJ,,"The UK government is providing a £220 million UK Community Renewal Fund (UKCRF) that seeks to help local areas prepare for the launch of the UK Shared Prosperity Fund in 2022. The Department of Biosciences at Swansea University have received funding for a green infrastructure (GI) project based in Neath Port Talbot: A roadmap for restoring, enhancing and connecting Green Infrastructure for people and nature in a post-industrial landscape. This will develop the scientific evidence-base required to allow the Neath Port Talbot Council (NPTC) area to strategically create a resilient GI network. NPTC has a legacy of industrial decline, with below average incomes, major health inequalities (including mental health and wellbeing), poor air quality and high unemployment. The project targets economically deprived communities and places close to underused greenspaces, to improve health and wellbeing outcomes by reconnecting people with nature.
""The UK government is providing a £220 million UK Community Renewal Fund (UKCRF) that seeks to help local areas prepare for the launch of the UK Shared Prosperity Fund in 2022. The Department of Biosciences at Swansea University have received funding for a green infrastructure (GI) project based in Neath Port Talbot: A roadmap for restoring, enhancing and connecting Green Infrastructure for people and nature in a post-industrial landscape. This will develop the scientific evidence-base required to allow the Neath Port Talbot Council (NPTC) area to strategically create a resilient GI network. NPTC has a legacy of industrial decline, with below average incomes, major health inequalities (including mental health and wellbeing), poor air quality and high unemployment. The project targets economically deprived communities and places close to underused greenspaces, to improve health and wellbeing outcomes by reconnecting people with nature.",,,"£446,865 ",1,#N/A,#N/A,2,3,21,12,,,,,,,,,,,,,,,,,,,,,,"£446,865 ",,,,,,,,,,,,,,,,,,,,,,,,,,,,,,,,,,,,,,,,,,,,,,,,,,,,,,,,,,,,,,,,,,,,,,,,,,,,,,,,,,,,,,,,,,,,,,,,,,,,,,,,,,,,,,,,,,,,,,,,,,,,,,,,,,,,,,,,,,,,,,,,,,,,,,,,,,,,,,,,,,,,,,,,,,,,,,,,,,,,,,,
107,Digital Bridges -Bridging the Digital Divide,Neath Port Talbot Council,SA13 1PJ,,"Participate in the digital society to improve your employment prospects, IT ability, financial skills, health and well being. Training will be delivered in two ways - classroom and virtually. The project will remove the barriers of skills and cost that prevent people from becoming digitally engaged.",,,"£315,251 ",1,#N/A,#N/A,2,2,23,12,,,,,,,,,,,,,,,,,,,,,,"£315,251 ",,,,,,,,,,,,,,,,,,,,,,,,,,,,,,,,,,,,,,,,,,,,,,,,,,,,,,,,,,,,,,,,,,,,,,,,,,,,,,,,,,,,,,,,,,,,,,,,,,,,,,,,,,,,,,,,,,,,,,,,,,,,,,,,,,,,,,,,,,,,,,,,,,,,,,,,,,,,,,,,,,,,,,,,,,,,,,,,,,,,,,,
108,JOBSTART,Neath Port Talbot Council,SA13 1PJ,,"To support unemployed and economically inactive people unable to access existing provision, into sustainable employment.",,,"£510,000 ",1,#N/A,#N/A,2,2,23,12,,,,,,,,,,,,,,,,,,,,,,"£510,000 ",,,,,,,,,,,,,,,,,,,,,,,,,,,,,,,,,,,,,,,,,,,,,,,,,,,,,,,,,,,,,,,,,,,,,,,,,,,,,,,,,,,,,,,,,,,,,,,,,,,,,,,,,,,,,,,,,,,,,,,,,,,,,,,,,,,,,,,,,,,,,,,,,,,,,,,,,,,,,,,,,,,,,,,,,,,,,,,,,,,,,,,
109,Neath Port Talbot Third Sector Grant Scheme,Neath Port Talbot Council,SA13 1PJ,,"Grant support for third sector organisations focusing on skills, social enterprise support, decarbonisation activities.",,,"£510,000 ",1,#N/A,#N/A,2,2,21,12,,,,,,,,,,,,,,,,,,,,,,"£510,000 ",,,,,,,,,,,,,,,,,,,,,,,,,,,,,,,,,,,,,,,,,,,,,,,,,,,,,,,,,,,,,,,,,,,,,,,,,,,,,,,,,,,,,,,,,,,,,,,,,,,,,,,,,,,,,,,,,,,,,,,,,,,,,,,,,,,,,,,,,,,,,,,,,,,,,,,,,,,,,,,,,,,,,,,,,,,,,,,,,,,,,,,
110,Next Steps - Employability Support and Work Experience,Neath Port Talbot Council,SA13 1PJ,,"To support young people with emotional wellbeing, re-engage into school, careers & training",,,"£509,543 ",1,#N/A,#N/A,2,3,23,12,,,,,,,,,,,,,,,,,,,,,,"£509,543 ",,,,,,,,,,,,,,,,,,,,,,,,,,,,,,,,,,,,,,,,,,,,,,,,,,,,,,,,,,,,,,,,,,,,,,,,,,,,,,,,,,,,,,,,,,,,,,,,,,,,,,,,,,,,,,,,,,,,,,,,,,,,,,,,,,,,,,,,,,,,,,,,,,,,,,,,,,,,,,,,,,,,,,,,,,,,,,,,,,,,,,,
111,Supporting Business Growth and Innovation,Neath Port Talbot Council,SA13 1PJ,,Trial new business support interventions to meet gaps in provision. Equip businesses with the skills they need to exploit new growth opportunities.,,,"£120,715 ",1,#N/A,#N/A,2,2,23,12,,,,,,,,,,,,,,,,,,,,,,"£120,715 ",,,,,,,,,,,,,,,,,,,,,,,,,,,,,,,,,,,,,,,,,,,,,,,,,,,,,,,,,,,,,,,,,,,,,,,,,,,,,,,,,,,,,,,,,,,,,,,,,,,,,,,,,,,,,,,,,,,,,,,,,,,,,,,,,,,,,,,,,,,,,,,,,,,,,,,,,,,,,,,,,,,,,,,,,,,,,,,,,,,,,,,
112,Business Support in Pillgwenlly,Newport City Council,NP20 4UR,,The economic regeneration of the Pill area of Newport.,,,"£60,741 ",1,#N/A,#N/A,3,3,23,,,,,,,,,,,,,,,,,,,,,,,,,,,,,,,,,,,,,,,,,,,,,Newport,Newport,Newport,Newport,Newport,Newport,Newport,Newport,Newport,Newport,,,,,,,,,,,,,,,,,,,,,,,,,,,,,,,,,,,,,,,,,NP20 2,NP20 1,NP20 4,NP20 3,NP20 5,NP20 6,NP19 0,NP19 4,NP19 8,NP19 7,,,,,,,,,,,,,,,,,,,,,,,,,,,,,,,,,,,,,,,,,6074.1,6074.1,6074.1,6074.1,6074.1,6074.1,6074.1,6074.1,6074.1,6074.1,,,,,,,,,,,,,,,,,,,,,,,,,,,,,,,,,,,,,,,,,,,,,,,,,,,,
113,"Development of Welsh Institute of Digital Information (WIDI), Research and Development Centre in Newport",Newport City Council,NP20 4UR,,"A Research and Development Centre is being created by the Welsh Institute of Digital Information (WIDI) at USW’s Newport Campus with funding from the UK Community Renewal Fund.  To support WIDI’s aim of enhancing digital workforce development and research in health and care, the new centre will include the design and prototyping of an online Digital Health Village to provide nursing and allied health care students the opportunity to train in a simulated environment, as well as the development of online teaching material related to Digital Health and Care. ",,,"£745,617 ",1,#N/A,#N/A,3,2,23,,,,,,,,,,,,,,,,,,,,,,,,,,,,,,,,,,,,,,,,,,,,,Newport,,,,,,,,,,,,,,,,,,,,,,,,,,,,,,,,,,,,,,,,,,,,,,,,,,NP20 2,,,,,,,,,,,,,,,,,,,,,,,,,,,,,,,,,,,,,,,,,,,,,,,,,,745617,,,,,,,,,,,,,,,,,,,,,,,,,,,,,,,,,,,,,,,,,,,,,,,,,,,,,,,,,,,,,
114,Foot in the Door,Newport City Council,NP20 4UR,,Sector skills. Over 40 skills & training events and activities have been delivered across Newport ranging from raising awareness and access in local communities through to film and TV training and placing trainees on set for paid placements.   ,,,"£858,642 ",1,#N/A,#N/A,2,3,21,20,,,,,,,,,,,,,,,,,,,,,,"£858,642 ",,,,,,,,,,,,,,,,,,,,,,,,,,,,,,,,,,,,,,,,,,,,,,,,,,,,,,,,,,,,,,,,,,,,,,,,,,,,,,,,,,,,,,,,,,,,,,,,,,,,,,,,,,,,,,,,,,,,,,,,,,,,,,,,,,,,,,,,,,,,,,,,,,,,,,,,,,,,,,,,,,,,,,,,,,,,,,,,,,,,,,,
115,Greening Maindee,Newport City Council,NP20 4UR,,"Greening Maindee Together project is underway to encourage access to green spaces for health & wellbeing, engage different cultural groups in the local area, teach new skills, encourage communication, inclusivity, and diversity, promote sustainability, green infrastructure, and climate change action. ",,,"£176,480 ",1,#N/A,#N/A,3,3,23,,,,,,,,,,,,,,,,,,,,,,,,,,,,,,,,,,,,,,,,,,,,,Newport,Newport,Newport,Newport,Newport,Newport,Newport,Newport,Newport,Newport,,,,,,,,,,,,,,,,,,,,,,,,,,,,,,,,,,,,,,,,,NP20 2,NP20 1,NP20 4,NP20 3,NP20 5,NP20 6,NP19 0,NP19 4,NP19 8,NP19 7,,,,,,,,,,,,,,,,,,,,,,,,,,,,,,,,,,,,,,,,,17648.04,17648.04,17648.04,17648.04,17648.04,17648.04,17648.04,17648.04,17648.04,17648.04,,,,,,,,,,,,,,,,,,,,,,,,,,,,,,,,,,,,,,,,,,,,,,,,,,,,
116,Newport 360,Newport City Council,NP20 4UR,,"The Newport 360 project is designed to ""upskill"" people in the city who are not currently ""economically active"". Run by the organisation Volunteering Matters, the project aims to work with local businesses and ""diversify"" their hiring policies, as well as giving prospective workers better training for finding jobs, building their CVs and interview skills. The scheme has been awarded £400,000 from the UK Government fund.",,,"£408,642 ",1,#N/A,#N/A,2,2,23,20,,,,,,,,,,,,,,,,,,,,,,"£408,642 ",,,,,,,,,,,,,,,,,,,,,,,,,,,,,,,,,,,,,,,,,,,,,,,,,,,,,,,,,,,,,,,,,,,,,,,,,,,,,,,,,,,,,,,,,,,,,,,,,,,,,,,,,,,,,,,,,,,,,,,,,,,,,,,,,,,,,,,,,,,,,,,,,,,,,,,,,,,,,,,,,,,,,,,,,,,,,,,,,,,,,,,
117,Sgiliau,Newport City Council,NP20 4UR,,"The Sgiliau project, run by TGP Cymru, will receive £328,000 to provide education and job opportunities to young people aged 16-25 who have been in care and are currently not in education, employment or training. The project will ""improve and enhance their prospects"" of finding a place in education or training, as well as ""appropriate housing and support"", the council said.",,,"£335,457 ",1,#N/A,#N/A,2,2,21,20,,,,,,,,,,,,,,,,,,,,,,"£335,457 ",,,,,,,,,,,,,,,,,,,,,,,,,,,,,,,,,,,,,,,,,,,,,,,,,,,,,,,,,,,,,,,,,,,,,,,,,,,,,,,,,,,,,,,,,,,,,,,,,,,,,,,,,,,,,,,,,,,,,,,,,,,,,,,,,,,,,,,,,,,,,,,,,,,,,,,,,,,,,,,,,,,,,,,,,,,,,,,,,,,,,,,
118,Young Enterprise Newport,Newport City Council,NP20 4UR,,"Young Enterprise Newport is another scheme geared towards helping younger adults find work. Run by Business in Focus, the project is set to receive £213,000 funding, and will work with young people and women entrepreneurs on a pilot scheme for developing business skills.",,,"£217,389 ",1,#N/A,#N/A,2,2,23,20,,,,,,,,,,,,,,,,,,,,,,"£217,389 ",,,,,,,,,,,,,,,,,,,,,,,,,,,,,,,,,,,,,,,,,,,,,,,,,,,,,,,,,,,,,,,,,,,,,,,,,,,,,,,,,,,,,,,,,,,,,,,,,,,,,,,,,,,,,,,,,,,,,,,,,,,,,,,,,,,,,,,,,,,,,,,,,,,,,,,,,,,,,,,,,,,,,,,,,,,,,,,,,,,,,,,
119,Climate Adaptation - Addressing climate risks in Pembrokeshire's Communities,Pembrokeshire County Council,SA61 1TP,,"The project will develop a Pembrokeshire Climate Adaptation Strategy, ensuring the public and third sector influence strategic planning, place based planning and targeted climate adaptation actions on the ground.  It is supported by Pembrokeshire’s PSB and is needed as climate impacts will affect decision making, service delivery and partnership work.",,,"£50,175 ",1,#N/A,#N/A,2,2,23,9,,,,,,,,,,,,,,,,,,,,,,"£50,175 ",,,,,,,,,,,,,,,,,,,,,,,,,,,,,,,,,,,,,,,,,,,,,,,,,,,,,,,,,,,,,,,,,,,,,,,,,,,,,,,,,,,,,,,,,,,,,,,,,,,,,,,,,,,,,,,,,,,,,,,,,,,,,,,,,,,,,,,,,,,,,,,,,,,,,,,,,,,,,,,,,,,,,,,,,,,,,,,,,,,,,,,
120,Developing the Pembroke Town Walls Management Plan,Pembrokeshire County Council,SA61 1TP,,"To develop an innovative long-term plan to restore and manage Pembroke’s deteriorating medieval town walls, exploring and delivering solutions to issues of sustainable funding for listed structures in multiple private ownership, the significant lack of heritage construction skills training in Wales, and increasing a sense of community ownership and place. ",,,"£119,484 ",1,#N/A,#N/A,3,3,23,,,,,,,,,,,,,,,,,,,,,,,,,,,,,,,,,,,,,,,,,,,,,Pembroke,Pembroke,,,,,,,,,,,,,,,,,,,,,,,,,,,,,,,,,,,,,,,,,,,,,,,,,SA71 4,SA71 5,,,,,,,,,,,,,,,,,,,,,,,,,,,,,,,,,,,,,,,,,,,,,,,,,59742,59742,,,,,,,,,,,,,,,,,,,,,,,,,,,,,,,,,,,,,,,,,,,,,,,,,,,,,,,,,,,,
121,Ecosystem Enterprise Partnership - Building Natural Solutions,Pembrokeshire County Council,SA61 1TP,,"The project aims to overcome challenges which would halt housing development, due to NRW’s position on phosphates and SAC rivers. Quantifying phosphate impacts of planned housing / agricultural developments, engaging land managers, finding and costing solutions, and creating mitigation plans for specific developments will allow planning permission to be granted. ",,,"£142,943 ",1,#N/A,#N/A,2,3,23,9,,,,,,,,,,,,,,,,,,,,,,"£142,943 ",,,,,,,,,,,,,,,,,,,,,,,,,,,,,,,,,,,,,,,,,,,,,,,,,,,,,,,,,,,,,,,,,,,,,,,,,,,,,,,,,,,,,,,,,,,,,,,,,,,,,,,,,,,,,,,,,,,,,,,,,,,,,,,,,,,,,,,,,,,,,,,,,,,,,,,,,,,,,,,,,,,,,,,,,,,,,,,,,,,,,,,
