CaseID,ProjectTitle,Applicant,Applicant postcode,Scheme,ProjectDescription,Projectstartdate,Projectenddate,Govfundsawarded,record_complete,match_rdp,match_sfp,Geo,Visibility,Timing,county1,county2,county3,county4,county5,county6,county7,county8,county9,county10,county11,county12,county13,county14,county15,county16,county17,county18,county19,county20,county21,county22,county1cash,county2cash,county3cash,county4cash,county5cash,county6cash,county7cash,county8cash,county9cash,county10cash,county11cash,county12cash,county13cash,county14cash,county15cash,county16cash,county17cash,county18cash,county19cash,county20cash,county21cash,county22cash,Local1,Local2,Local3,Local4,Local5,Local6,Local7,Local8,Local9,Local10,Local11,Local12,Local13,Local14,Local15,Local16,Local17,Local18,Local19,Local20,Local21,Local22,Local23,Local24,Local25,Local26,Local27,Local28,Local29,Local30,Local31,Local32,Local33,Local34,Local35,Local36,Local37,Local38,Local39,Local40,Local41,Local42,Local43,Local44,Local45,Local46,Local47,Local48,Local49,Local50,postcode_sector1,postcode_sector2,postcode_sector3,postcode_sector4,postcode_sector5,postcode_sector6,postcode_sector7,postcode_sector8,postcode_sector9,postcode_sector10,postcode_sector11,postcode_sector12,postcode_sector13,postcode_sector14,postcode_sector15,postcode_sector16,postcode_sector17,postcode_sector18,postcode_sector19,postcode_sector20,postcode_sector21,postcode_sector22,postcode_sector23,postcode_sector24,postcode_sector25,postcode_sector26,postcode_sector27,postcode_sector28,postcode_sector29,postcode_sector30,postcode_sector31,postcode_sector32,postcode_sector33,postcode_sector34,postcode_sector35,postcode_sector36,postcode_sector37,postcode_sector38,postcode_sector39,postcode_sector40,postcode_sector41,postcode_sector42,postcode_sector43,postcode_sector44,postcode_sector45,postcode_sector46,postcode_sector47,postcode_sector48,postcode_sector49,postcode_sector50,spending1,spending2,spending3,spending4,spending5,spending6,spending7,spending8,spending9,spending10,spending11,spending12,spending13,spending14,spending15,spending16,spending17,spending18,spending19,spending20,spending21,spending22,spending23,spending24,spending25,spending26,spending27,spending28,spending29,spending30,spending31,spending32,spending33,spending34,spending35,spending36,spending37,spending38,spending39,spending40,spending41,spending42,spending43,spending44,spending45,spending46,spending47,spending48,spending49,spending50,Doc1,Doc2,Doc3,Doc4,Doc5,Doc6,Doc7,Doc8,,,,Notes
1,Blaenau Gwent Construction & Environmental routes into employment,Blaenau Gwent County Borough Council,NP23 6DN,,No details found,,,"£50,320 ",0,#N/A,#N/A,,,,,,,,,,,,,,,,,,,,,,,,,,,,,,,,,,,,,,,,,,,,,,,,,,,,,,,,,,,,,,,,,,,,,,,,,,,,,,,,,,,,,,,,,,,,,,,,,,,,,,,,,,,,,,,,,,,,,,,,,,,,,,,,,,,,,,,,,,,,,,,,,,,,,,,,,,,,,,,,,,,,,,,,,,,,,,,,,,,,,,,,,,,,,,,,,,,,,,,,,,,,,,,,,
2,Blaenau Gwent NEET and Adult Employability Programme,Blaenau Gwent County Borough Council,NP23 6DN,,"In Blaenau Gwent there are a number of services that offer support for young people aged 11-25 who at risk of becoming or are currently not in Education, Employment or Training (NEET).",,,"£353,518 ",1,#N/A,#N/A,2,2,23,17,,,,,,,,,,,,,,,,,,,,,,"£353,518 ",,,,,,,,,,,,,,,,,,,,,,,,,,,,,,,,,,,,,,,,,,,,,,,,,,,,,,,,,,,,,,,,,,,,,,,,,,,,,,,,,,,,,,,,,,,,,,,,,,,,,,,,,,,,,,,,,,,,,,,,,,,,,,,,,,,,,,,,,,,,,,,,,,,,,,,,,,,,,,,,,,,,,,,,,,,,,,,,,,,,,,,
3,Digital Technology Learning Support Network,Blaenau Gwent County Borough Council,NP23 6DN,,"Working with Welsh primary and secondary schools, parents and teachers to set up an authentic Digital Technology Learning Support Network (DTLSN)",,,"£179,421 ",1,#N/A,#N/A,2,3,23,17,,,,,,,,,,,,,,,,,,,,,,"£179,421 ",,,,,,,,,,,,,,,,,,,,,,,,,,,,,,,,,,,,,,,,,,,,,,,,,,,,,,,,,,,,,,,,,,,,,,,,,,,,,,,,,,,,,,,,,,,,,,,,,,,,,,,,,,,,,,,,,,,,,,,,,,,,,,,,,,,,,,,,,,,,,,,,,,,,,,,,,,,,,,,,,,,,,,,,,,,,,,,,,,,,,,,
4,EVi Community and Cultural Centre,Blaenau Gwent County Borough Council,NP23 6DN,,"The Ebbw Vale Institute (EVI) Community and Cultural Centre has been carrying out extensive refurbishment and essential repairs at the historic Grade 2 listed building after being awarded £250,000 through the Welsh Government Communities Facilities Programme, securing its sustainability for future generations to enjoy.",,,"£266,087 ",1,#N/A,#N/A,3,3,8,,,,,,,,,,,,,,,,,,,,,,,,,,,,,,,,,,,,,,,,,,,,,Ebbw Vale,,,,,,,,,,,,,,,,,,,,,,,,,,,,,,,,,,,,,,,,,,,,,,,,,,NP23 6,,,,,,,,,,,,,,,,,,,,,,,,,,,,,,,,,,,,,,,,,,,,,,,,,,266087,,,,,,,,,,,,,,,,,,,,,,,,,,,,,,,,,,,,,,,,,,,,,,,,,,,,,,,,,,,,,
5,Helping Nature Help us Recover,Blaenau Gwent County Borough Council,NP23 6DN,,"Through this project, Gwent Wildlife Trust is providing training in skills for employment in conservation and the environment sector for people in Blaenau Gwent. We are also building on our work to help nature recover in the region by developing opportunities for practical volunteering on green spaces: to build ‘green skills’, improve the local natural environment and enhance participants' health and wellbeing.",,,"£179,446 ",1,#N/A,#N/A,2,3,23,17,,,,,,,,,,,,,,,,,,,,,,"£179,446 ",,,,,,,,,,,,,,,,,,,,,,,,,,,,,,,,,,,,,,,,,,,,,,,,,,,,,,,,,,,,,,,,,,,,,,,,,,,,,,,,,,,,,,,,,,,,,,,,,,,,,,,,,,,,,,,,,,,,,,,,,,,,,,,,,,,,,,,,,,,,,,,,,,,,,,,,,,,,,,,,,,,,,,,,,,,,,,,,,,,,,,,
6,HIVE PROJECT,Blaenau Gwent County Borough Council,NP23 6DN,,"Bringing together industry and education in high-value engineering, the HiVE Centre will offer research and development opportunities for industry partners, and it will be a base for school and employer outreach programmes, benefiting the wider community.",,,"£145,809 ",1,#N/A,#N/A,3,3,20,,,,,,,,,,,,,,,,,,,,,,,,,,,,,,,,,,,,,,,,,,,,,Ebbw Vale,,,,,,,,,,,,,,,,,,,,,,,,,,,,,,,,,,,,,,,,,,,,,,,,,,NP23 6,,,,,,,,,,,,,,,,,,,,,,,,,,,,,,,,,,,,,,,,,,,,,,,,,,145809,,,,,,,,,,,,,,,,,,,,,,,,,,,,,,,,,,,,,,,,,,,,,,,,,,,,,,,,,,,,,
7,THE LIFE YOU WANT,Blaenau Gwent County Borough Council,NP23 6DN,,The Life You Want Project provide opportunities in training and support into employment for people and communities in Wales.,,,"£216,603 ",1,#N/A,#N/A,2,2,23,17,,,,,,,,,,,,,,,,,,,,,,"£216,603 ",,,,,,,,,,,,,,,,,,,,,,,,,,,,,,,,,,,,,,,,,,,,,,,,,,,,,,,,,,,,,,,,,,,,,,,,,,,,,,,,,,,,,,,,,,,,,,,,,,,,,,,,,,,,,,,,,,,,,,,,,,,,,,,,,,,,,,,,,,,,,,,,,,,,,,,,,,,,,,,,,,,,,,,,,,,,,,,,,,,,,,,
8,Transforming Young Minds for Tomorrow - Trawsnewid Meddyliau Ifanc ar gyfer Yfory,Blaenau Gwent County Borough Council,NP23 6DN,,"The project would create interactive activities to expose both primary and secondary school pupils to the wonders of manufacturing and engineering. Making them aware of the range of innovative and rewarding careers available in the Advanced Materials and Manufacturing, Creative and Digital and Energy and Environment sectors in the region.",,,"£88,614 ",1,#N/A,#N/A,2,3,21,17,,,,,,,,,,,,,,,,,,,,,,"£88,614 ",,,,,,,,,,,,,,,,,,,,,,,,,,,,,,,,,,,,,,,,,,,,,,,,,,,,,,,,,,,,,,,,,,,,,,,,,,,,,,,,,,,,,,,,,,,,,,,,,,,,,,,,,,,,,,,,,,,,,,,,,,,,,,,,,,,,,,,,,,,,,,,,,,,,,,,,,,,,,,,,,,,,,,,,,,,,,,,,,,,,,,,
9,Valleys Innovation Showcase for Technological Advancement (VISTA),Blaenau Gwent County Borough Council,NP23 6DN,,"Funded by the UK Government's Community Renewal Fund, VISTA aims to engage at least 20 businesses in Blaenau Gwent over the next four months as part of a pilot programme that will offer a range of support options including, access to grants and consultants and academics in their field, as well opportunities to work with the Advanced Manufacturing Research Centre (AMRC), a network of research and innovation centres.",,,"£1,008,874 ",1,#N/A,#N/A,2,2,23,17,,,,,,,,,,,,,,,,,,,,,,"£1,008,874 ",,,,,,,,,,,,,,,,,,,,,,,,,,,,,,,,,,,,,,,,,,,,,,,,,,,,,,,,,,,,,,,,,,,,,,,,,,,,,,,,,,,,,,,,,,,,,,,,,,,,,,,,,,,,,,,,,,,,,,,,,,,,,,,,,,,,,,,,,,,,,,,,,,,,,,,,,,,,,,,,,,,,,,,,,,,,,,,,,,,,,,,
10,Young Enterprise Blaenau Gwent,Blaenau Gwent County Borough Council,NP23 6DN,,"Young Enterprise in Wales works in partnership with local schools, businesses and volunteers to inspire and equip thousands of young people each year to learn and succeed through enterprise. Together we ensure that young people grow up with the life skills, knowledge and confidence they need to succeed in the changing world of work.",,,"£219,520 ",1,#N/A,#N/A,2,3,23,17,,,,,,,,,,,,,,,,,,,,,,"£219,520 ",,,,,,,,,,,,,,,,,,,,,,,,,,,,,,,,,,,,,,,,,,,,,,,,,,,,,,,,,,,,,,,,,,,,,,,,,,,,,,,,,,,,,,,,,,,,,,,,,,,,,,,,,,,,,,,,,,,,,,,,,,,,,,,,,,,,,,,,,,,,,,,,,,,,,,,,,,,,,,,,,,,,,,,,,,,,,,,,,,,,,,,
11,Bridgend Elevate and Prosper (EAP),Bridgend County Borough Council,CF31 4WB,,"The project will work by developing a series of popup initiatives to create opportunities for start-up and micro business growth, encourage greater footfall and dwell time, and enable greater resilience with a ‘quicker, lighter, cheaper’ approach to test a series of changes.",,,"£122,400 ",1,#N/A,#N/A,2,2,21,13,,,,,,,,,,,,,,,,,,,,,,"£122,400 ",,,,,,,,,,,,,,,,,,,,,,,,,,,,,,,,,,,,,,,,,,,,,,,,,,,,,,,,,,,,,,,,,,,,,,,,,,,,,,,,,,,,,,,,,,,,,,,,,,,,,,,,,,,,,,,,,,,,,,,,,,,,,,,,,,,,,,,,,,,,,,,,,,,,,,,,,,,,,,,,,,,,,,,,,,,,,,,,,,,,,,,https://www.bridgend.gov.uk/news/creative-pop-ups-help-to-boost-bridgend-county-borough/
12,Connecting Teachers with Industry,Bridgend County Borough Council,CF31 4WB,,"The Connecting Teachers with Industry Project is an excellent opportunity for teachers and students from schools in the Bridgend and Rhondda Cynon Taf local authorities, to find out about the exciting careers available in the Science, Technology, Engineering, Arts and Math (STEAM) sectors in Wales.",,,"£57,842 ",1,#N/A,#N/A,2,3,21,13,,,,,,,,,,,,,,,,,,,,,,"£57,842 ",,,,,,,,,,,,,,,,,,,,,,,,,,,,,,,,,,,,,,,,,,,,,,,,,,,,,,,,,,,,,,,,,,,,,,,,,,,,,,,,,,,,,,,,,,,,,,,,,,,,,,,,,,,,,,,,,,,,,,,,,,,,,,,,,,,,,,,,,,,,,,,,,,,,,,,,,,,,,,,,,,,,,,,,,,,,,,,,,,,,,,,
13,Enterprise Bridgend,Bridgend County Borough Council,CF31 4WB,,"Enterprise Bridgend aims to support people, especially women, who have been furloughed during the pandemic or who may be unemployed / economically inactive by helping them develop skills and confidence for moving into self-employment.",,,"£217,389 ",1,#N/A,#N/A,2,2,23,13,,,,,,,,,,,,,,,,,,,,,,"£217,389 ",,,,,,,,,,,,,,,,,,,,,,,,,,,,,,,,,,,,,,,,,,,,,,,,,,,,,,,,,,,,,,,,,,,,,,,,,,,,,,,,,,,,,,,,,,,,,,,,,,,,,,,,,,,,,,,,,,,,,,,,,,,,,,,,,,,,,,,,,,,,,,,,,,,,,,,,,,,,,,,,,,,,,,,,,,,,,,,,,,,,,,,Unclear information on visibility
14,THE LIFE YOU WANT,Bridgend County Borough Council,CF31 4WB,,The Life You Want Project provide opportunities in training and support into employment for people and communities in Wales.,,,"£204,300 ",1,#N/A,#N/A,2,2,23,13,,,,,,,,,,,,,,,,,,,,,,"£204,300 ",,,,,,,,,,,,,,,,,,,,,,,,,,,,,,,,,,,,,,,,,,,,,,,,,,,,,,,,,,,,,,,,,,,,,,,,,,,,,,,,,,,,,,,,,,,,,,,,,,,,,,,,,,,,,,,,,,,,,,,,,,,,,,,,,,,,,,,,,,,,,,,,,,,,,,,,,,,,,,,,,,,,,,,,,,,,,,,,,,,,,,,
15,Transforming Young Minds for Tomorrow - Trawsnewid Meddyliau Ifanc ar gyfer Yfory,Bridgend County Borough Council,CF31 4WB,,"The project would create interactive activities to expose both primary and secondary school pupils to the wonders of manufacturing and engineering. Making them aware of the range of innovative and rewarding careers available in the Advanced Materials and Manufacturing, Creative and Digital and Energy and Environment sectors in the region.",,,"£88,614 ",1,#N/A,#N/A,2,3,21,13,,,,,,,,,,,,,,,,,,,,,,"£88,614 ",,,,,,,,,,,,,,,,,,,,,,,,,,,,,,,,,,,,,,,,,,,,,,,,,,,,,,,,,,,,,,,,,,,,,,,,,,,,,,,,,,,,,,,,,,,,,,,,,,,,,,,,,,,,,,,,,,,,,,,,,,,,,,,,,,,,,,,,,,,,,,,,,,,,,,,,,,,,,,,,,,,,,,,,,,,,,,,,,,,,,,,
16,Women's focussed Incubator for Ambitious Entrepreneurs in Bridgend.,Bridgend County Borough Council,CF31 4WB,,"Focus on supporting women entrepreneurs in Caerphilly County Borough.  They will deliver a three-month business incubator programme to two cohorts (20 women in each) who have their own micro-businesses. The programme will be blended online learning with personalised needs analysis, 12 modules and four live workshops.",,,"£94,605 ",1,#N/A,#N/A,2,2,23,13,,,,,,,,,,,,,,,,,,,,,,"£94,605 ",,,,,,,,,,,,,,,,,,,,,,,,,,,,,,,,,,,,,,,,,,,,,,,,,,,,,,,,,,,,,,,,,,,,,,,,,,,,,,,,,,,,,,,,,,,,,,,,,,,,,,,,,,,,,,,,,,,,,,,,,,,,,,,,,,,,,,,,,,,,,,,,,,,,,,,,,,,,,,,,,,,,,,,,,,,,,,,,,,,,,,,
17,Engaging Enterprise,Caerphilly County Borough Council,CF31 4WB,,"The project is designed to support people considering self-employment, transform lives by delivering results-based learning linked to ground-breaking technology.  A seven-week course will be delivered digitally to up to 780 participants. The project will concentrate on those with complex barriers, the over-50s and those within the gig economy.",,,"£811,074 ",1,#N/A,#N/A,2,2,23,16,,,,,,,,,,,,,,,,,,,,,,"£811,074 ",,,,,,,,,,,,,,,,,,,,,,,,,,,,,,,,,,,,,,,,,,,,,,,,,,,,,,,,,,,,,,,,,,,,,,,,,,,,,,,,,,,,,,,,,,,,,,,,,,,,,,,,,,,,,,,,,,,,,,,,,,,,,,,,,,,,,,,,,,,,,,,,,,,,,,,,,,,,,,,,,,,,,,,,,,,,,,,,,,,,,,,Assume only Caerphilly
18,Enterprise Caerphilly,Caerphilly County Borough Council,CF31 4WB,,"Tailored specifically for economically inactive/unemployed/furloughed individuals and delivered predominantly online, the project will support people into self-employment and will build skills and confidence. The project invests in digital, employability and entrepreneurial skills. It supports newly established micro-businesses and supplements mainstream provision, working closely with community partners.",,,"£217,389 ",1,#N/A,#N/A,2,2,23,16,,,,,,,,,,,,,,,,,,,,,,"£217,389 ",,,,,,,,,,,,,,,,,,,,,,,,,,,,,,,,,,,,,,,,,,,,,,,,,,,,,,,,,,,,,,,,,,,,,,,,,,,,,,,,,,,,,,,,,,,,,,,,,,,,,,,,,,,,,,,,,,,,,,,,,,,,,,,,,,,,,,,,,,,,,,,,,,,,,,,,,,,,,,,,,,,,,,,,,,,,,,,,,,,,,,,Unclear information on visibility
19,THE LIFE YOU WANT,Caerphilly County Borough Council,CF31 4WB,,The Life You Want Project provide opportunities in training and support into employment for people and communities in Wales.,,,"£204,300 ",1,#N/A,#N/A,2,2,23,16,,,,,,,,,,,,,,,,,,,,,,"£204,300 ",,,,,,,,,,,,,,,,,,,,,,,,,,,,,,,,,,,,,,,,,,,,,,,,,,,,,,,,,,,,,,,,,,,,,,,,,,,,,,,,,,,,,,,,,,,,,,,,,,,,,,,,,,,,,,,,,,,,,,,,,,,,,,,,,,,,,,,,,,,,,,,,,,,,,,,,,,,,,,,,,,,,,,,,,,,,,,,,,,,,,,,
20,Women's focussed Incubator for Ambitious Entrepreneurs in Caerphilly,Caerphilly County Borough Council,CF31 4WB,,"Focus on supporting women entrepreneurs in Caerphilly County Borough.  They will deliver a three-month business incubator programme to two cohorts (20 women in each) who have their own micro-businesses. The programme will be blended online learning with personalised needs analysis, 12 modules and four live workshops.",,,"£94,605 ",1,#N/A,#N/A,2,2,23,16,,,,,,,,,,,,,,,,,,,,,,"£94,605 ",,,,,,,,,,,,,,,,,,,,,,,,,,,,,,,,,,,,,,,,,,,,,,,,,,,,,,,,,,,,,,,,,,,,,,,,,,,,,,,,,,,,,,,,,,,,,,,,,,,,,,,,,,,,,,,,,,,,,,,,,,,,,,,,,,,,,,,,,,,,,,,,,,,,,,,,,,,,,,,,,,,,,,,,,,,,,,,,,,,,,,,
21,Beicio Treganna Cycle,Cardiff Council,CF10 4UW,,No details found,,,"£6,630 ",0,#N/A,#N/A,,,,,,,,,,,,,,,,,,,,,,,,,,,,,,,,,,,,,,,,,,,,,,,,,,,,,,,,,,,,,,,,,,,,,,,,,,,,,,,,,,,,,,,,,,,,,,,,,,,,,,,,,,,,,,,,,,,,,,,,,,,,,,,,,,,,,,,,,,,,,,,,,,,,,,,,,,,,,,,,,,,,,,,,,,,,,,,,,,,,,,,,,,,,,,,,,,,,,,,,,,,,,,,,,
22,Connecting and caring for Grangetown's Green Spaces,Cardiff Council,CF10 4UW,,"Connecting and Caring for Grangetown’s Green Spaces is a 6-month project starting in January 2022, funded by the UK Government UK Community Renewal Fund, and managed by the Grange Pavilion Charitable Incorporated Organisation. ",,,"£66,876 ",1,#N/A,#N/A,3,3,21,,,,,,,,,,,,,,,,,,,,,,,,,,,,,,,,,,,,,,,,,,,,,Cardiff,Cardiff,Cardiff,Cardiff,,,,,,,,,,,,,,,,,,,,,,,,,,,,,,,,,,,,,,,,,,,,,,,CF11 6,CF11 7,CF11 8,CF11 0,,,,,,,,,,,,,,,,,,,,,,,,,,,,,,,,,,,,,,,,,,,,,,,16719.08,16719.08,16719.08,16719.08,,,,,,,,,,,,,,,,,,,,,,,,,,,,,,,,,,,,,,,,,,,,,,,,,,,,,,,,,,
23,Cycling Together,Cardiff Council,CF10 4UW,,No details found,,,"£15,300 ",0,#N/A,#N/A,,,,,,,,,,,,,,,,,,,,,,,,,,,,,,,,,,,,,,,,,,,,,,,,,,,,,,,,,,,,,,,,,,,,,,,,,,,,,,,,,,,,,,,,,,,,,,,,,,,,,,,,,,,,,,,,,,,,,,,,,,,,,,,,,,,,,,,,,,,,,,,,,,,,,,,,,,,,,,,,,,,,,,,,,,,,,,,,,,,,,,,,,,,,,,,,,,,,,,,,,,,,,,,,,
24,"Employer Needs, Future Workers!",Cardiff Council,CF10 4UW,,"Help with CV writing, skills for work, and developing knowledge of local businesses.",,,"£68,763 ",1,#N/A,#N/A,2,2,23,21,,,,,,,,,,,,,,,,,,,,,,"£68,763 ",,,,,,,,,,,,,,,,,,,,,,,,,,,,,,,,,,,,,,,,,,,,,,,,,,,,,,,,,,,,,,,,,,,,,,,,,,,,,,,,,,,,,,,,,,,,,,,,,,,,,,,,,,,,,,,,,,,,,,,,,,,,,,,,,,,,,,,,,,,,,,,,,,,,,,,,,,,,,,,,,,,,,,,,,,,,,,,,,,,,,,,Asssume only Cardiff
25,Enterprise Cardiff,Cardiff Council,CF10 4UW,,Supporting people going in to self-employment.,,,"£219,520 ",1,#N/A,#N/A,2,2,23,21,,,,,,,,,,,,,,,,,,,,,,"£219,520 ",,,,,,,,,,,,,,,,,,,,,,,,,,,,,,,,,,,,,,,,,,,,,,,,,,,,,,,,,,,,,,,,,,,,,,,,,,,,,,,,,,,,,,,,,,,,,,,,,,,,,,,,,,,,,,,,,,,,,,,,,,,,,,,,,,,,,,,,,,,,,,,,,,,,,,,,,,,,,,,,,,,,,,,,,,,,,,,,,,,,,,,Unclear information on visibility
26,Migrant Employment Assistance Wales / MEA Wales,Cardiff Council,CF10 4UW,,No details found,,,"£110,632 ",0,#N/A,#N/A,,,,,,,,,,,,,,,,,,,,,,,,,,,,,,,,,,,,,,,,,,,,,,,,,,,,,,,,,,,,,,,,,,,,,,,,,,,,,,,,,,,,,,,,,,,,,,,,,,,,,,,,,,,,,,,,,,,,,,,,,,,,,,,,,,,,,,,,,,,,,,,,,,,,,,,,,,,,,,,,,,,,,,,,,,,,,,,,,,,,,,,,,,,,,,,,,,,,,,,,,,,,,,,,,
27,Priority Sector Skills Academies,Cardiff Council,CF10 4UW,,Cardiff and Vale College - realise the first ever Priority Sector Skills Academies in Wales. Three 35-hour-per-week full-time intensive upskilling courses designed to meet the needs of local industry. ,,,"£138,284 ",1,#N/A,#N/A,3,2,20,,,,,,,,,,,,,,,,,,,,,,,,,,,,,,,,,,,,,,,,,,,,,Cardiff,,,,,,,,,,,,,,,,,,,,,,,,,,,,,,,,,,,,,,,,,,,,,,,,,,CF3 1,,,,,,,,,,,,,,,,,,,,,,,,,,,,,,,,,,,,,,,,,,,,,,,,,,138284,,,,,,,,,,,,,,,,,,,,,,,,,,,,,,,,,,,,,,,,,,,,,,,,,,,,,,,,,,,,,
28,Rapid Reskilling,Cardiff Council,CF10 4UW,,No details found,,,"£156,892 ",0,#N/A,#N/A,,,,,,,,,,,,,,,,,,,,,,,,,,,,,,,,,,,,,,,,,,,,,,,,,,,,,,,,,,,,,,,,,,,,,,,,,,,,,,,,,,,,,,,,,,,,,,,,,,,,,,,,,,,,,,,,,,,,,,,,,,,,,,,,,,,,,,,,,,,,,,,,,,,,,,,,,,,,,,,,,,,,,,,,,,,,,,,,,,,,,,,,,,,,,,,,,,,,,,,,,,,,,,,,,
29,The Cardiff Circular Economy Network (CCEN),Cardiff Council,CF10 4UW,,"The Cardiff Circular Economy Network (CCEN) is a collaborative project between Cardiff Metropolitan University, Celsa Steel UK, One Planet Cardiff and Cardiff Commitment (Curriculum Development). The project is funded by the UK Government through the UK Community Renewal Fund.",,,"£53,807 ",1,#N/A,#N/A,2,2,23,21,,,,,,,,,,,,,,,,,,,,,,"£53,807 ",,,,,,,,,,,,,,,,,,,,,,,,,,,,,,,,,,,,,,,,,,,,,,,,,,,,,,,,,,,,,,,,,,,,,,,,,,,,,,,,,,,,,,,,,,,,,,,,,,,,,,,,,,,,,,,,,,,,,,,,,,,,,,,,,,,,,,,,,,,,,,,,,,,,,,,,,,,,,,,,,,,,,,,,,,,,,,,,,,,,,,,
30,Banc Sgiliau Busnes Sir Gar/ Business Skills Bank Sir Gar (BSB Sir Gar),Carmarthenshire County Council,SA31 1JP,,"Offering self-employed and micro enterprises the opportunity to develop an entrepreneurial, innovative culture by supporting them to access specialist skills, increase their performance and become more resilient and competitive in their marketplace.",,,"£110,160 ",1,#N/A,#N/A,2,2,23,10,,,,,,,,,,,,,,,,,,,,,,"£110,160 ",,,,,,,,,,,,,,,,,,,,,,,,,,,,,,,,,,,,,,,,,,,,,,,,,,,,,,,,,,,,,,,,,,,,,,,,,,,,,,,,,,,,,,,,,,,,,,,,,,,,,,,,,,,,,,,,,,,,,,,,,,,,,,,,,,,,,,,,,,,,,,,,,,,,,,,,,,,,,,,,,,,,,,,,,,,,,,,,,,,,,,,
31,Carmarthenshire Towns Recovery & growth pilot,Carmarthenshire County Council,SA31 1JP,,A suite of pilot activities delivered to develop and support Carmarthenshire’s 10 rural market towns and three primary towns as they recover from the pandemic.,,,"£226,746 ",1,#N/A,#N/A,2,2,23,10,,,,,,,,,,,,,,,,,,,,,,"£226,746 ",,,,,,,,,,,,,,,,,,,,,,,,,,,,,,,,,,,,,,,,,,,,,,,,,,,,,,,,,,,,,,,,,,,,,,,,,,,,,,,,,,,,,,,,,,,,,,,,,,,,,,,,,,,,,,,,,,,,,,,,,,,,,,,,,,,,,,,,,,,,,,,,,,,,,,,,,,,,,,,,,,,,,,,,,,,,,,,,,,,,,,,
32,"Carmarthenshire's Old Towns - Their Past, Present and Potential",Carmarthenshire County Council,SA31 1JP,,"Improving sense of place and supporting sustainable regeneration in Carmarthen, Llanelli and Newcastle Emlyn. It will contribute to the development of small-medium businesses, with practical skills training and expanding the local knowledge base.",,,"£187,152 ",1,#N/A,#N/A,2,2,23,10,,,,,,,,,,,,,,,,,,,,,,"£187,152 ",,,,,,,,,,,,,,,,,,,,,,,,,,,,,,,,,,,,,,,,,,,,,,,,,,,,,,,,,,,,,,,,,,,,,,,,,,,,,,,,,,,,,,,,,,,,,,,,,,,,,,,,,,,,,,,,,,,,,,,,,,,,,,,,,,,,,,,,,,,,,,,,,,,,,,,,,,,,,,,,,,,,,,,,,,,,,,,,,,,,,,,
33,"Digging Beneath the Surface - Archives, Archaeology and Access in Carmarthenshire",Carmarthenshire County Council,SA31 1JP,,"A project to discover, digitise and disseminate the rich and varied history of Carmarthenshire's internationally important heritage sites at the Dolaucothi and Dinefwr estates.",,,"£286,944 ",1,#N/A,#N/A,3,3,23,,,,,,,,,,,,,,,,,,,,,,,,,,,,,,,,,,,,,,,,,,,,,Caio,Llandeilo ,,,,,,,,,,,,,,,,,,,,,,,,,,,,,,,,,,,,,,,,,,,,,,,,,SA19 6,SA19 8,,,,,,,,,,,,,,,,,,,,,,,,,,,,,,,,,,,,,,,,,,,,,,,,,143472.18,143472.18,,,,,,,,,,,,,,,,,,,,,,,,,,,,,,,,,,,,,,,,,,,,,,,,,,,,,,,,,,,,
34,Dreigiau CYCA Dragons Y cyfle i fynnu - the opportunity to thrive,Carmarthenshire County Council,SA31 1JP,,Helping beneficiaries with business ideas. A panel of judges will convene monthly to hear business pitches from entrants with four finalists and two winners selected each month and given a start-up package of investment and tailored support. Individuals not ready for self-employment will have access to training and mentoring.,,,"£234,662 ",1,#N/A,#N/A,2,2,23,10,,,,,,,,,,,,,,,,,,,,,,"£234,662 ",,,,,,,,,,,,,,,,,,,,,,,,,,,,,,,,,,,,,,,,,,,,,,,,,,,,,,,,,,,,,,,,,,,,,,,,,,,,,,,,,,,,,,,,,,,,,,,,,,,,,,,,,,,,,,,,,,,,,,,,,,,,,,,,,,,,,,,,,,,,,,,,,,,,,,,,,,,,,,,,,,,,,,,,,,,,,,,,,,,,,,,
35,Enterprise Carmarthenshire,Carmarthenshire County Council,SA31 1JP,,"A pilot to support people into self-employment, building skills and confidence. Investing in digital, employability and entrepreneurial skills, and supporting newly established microbusinesses.",,,"£201,064 ",1,#N/A,#N/A,2,2,23,10,,,,,,,,,,,,,,,,,,,,,,"£201,064 ",,,,,,,,,,,,,,,,,,,,,,,,,,,,,,,,,,,,,,,,,,,,,,,,,,,,,,,,,,,,,,,,,,,,,,,,,,,,,,,,,,,,,,,,,,,,,,,,,,,,,,,,,,,,,,,,,,,,,,,,,,,,,,,,,,,,,,,,,,,,,,,,,,,,,,,,,,,,,,,,,,,,,,,,,,,,,,,,,,,,,,,Unclear information on visibility
36,Llanelli Town Centre Ambassador and Delivery Service Project,Carmarthenshire County Council,SA31 1JP,,Ambassadors will be appointed to welcome and signpost visitors and residents to services and attractions across the town centre. An electric cargo bike product delivery scheme will also be piloted with local businesses. A community fund will be available for emerging initiatives. ,,,"£181,101 ",1,#N/A,#N/A,3,3,23,,,,,,,,,,,,,,,,,,,,,,,,,,,,,,,,,,,,,,,,,,,,,Llanelli,Llanelli,Llanelli,Llanelli,Llanelli,,,,,,,,,,,,,,,,,,,,,,,,,,,,,,,,,,,,,,,,,,,,,,SA15 4,SA14 8,SA15 3,SA15 1,SA15 2,,,,,,,,,,,,,,,,,,,,,,,,,,,,,,,,,,,,,,,,,,,,,,36220.2,36220.2,36220.2,36220.2,36220.2,,,,,,,,,,,,,,,,,,,,,,,,,,,,,,,,,,,,,,,,,,,,,,,,,,,,,,,,,
37,Rapid Skills Shortage Response ,Carmarthenshire County Council,SA31 1JP,,"A collaborative education and industry led project to address immediate and medium-term skills gaps in the hospitality and construction sectors, supporting the employment markets for local businesses and communities, supporting unemployed people into employment, and up-skilling people to realise their potential.",,,"£824,947 ",1,#N/A,#N/A,2,2,23,10,,,,,,,,,,,,,,,,,,,,,,"£824,947 ",,,,,,,,,,,,,,,,,,,,,,,,,,,,,,,,,,,,,,,,,,,,,,,,,,,,,,,,,,,,,,,,,,,,,,,,,,,,,,,,,,,,,,,,,,,,,,,,,,,,,,,,,,,,,,,,,,,,,,,,,,,,,,,,,,,,,,,,,,,,,,,,,,,,,,,,,,,,,,,,,,,,,,,,,,,,,,,,,,,,,,,
38,Regenerating Llanelli,Carmarthenshire County Council,SA31 1JP,,"Complementing key projects and enhancing the regeneration of the Llanelli area - planning and mapping out a suite of ambitious, innovative, and transformational projects.",,,"£146,880 ",1,#N/A,#N/A,3,3,23,,,,,,,,,,,,,,,,,,,,,,,,,,,,,,,,,,,,,,,,,,,,,Llanelli,Llanelli,Llanelli,Llanelli,Llanelli,,,,,,,,,,,,,,,,,,,,,,,,,,,,,,,,,,,,,,,,,,,,,,SA15 4,SA14 8,SA15 3,SA15 1,SA15 2,,,,,,,,,,,,,,,,,,,,,,,,,,,,,,,,,,,,,,,,,,,,,,29376,29376,29376,29376,29376,,,,,,,,,,,,,,,,,,,,,,,,,,,,,,,,,,,,,,,,,,,,,,,,,,,,,,,,,
39,Revitalise Rhydaman,Carmarthenshire County Council,SA31 1JP,,"Building on Ammanford’s recovery plan to deliver four projects that will enable the town to harness solutions that will build a stronger, locally focussed and more resilient town.",,,"£151,470 ",1,#N/A,#N/A,3,3,23,,,,,,,,,,,,,,,,,,,,,,,,,,,,,,,,,,,,,,,,,,,,,Ammandford,Ammandford,,,,,,,,,,,,,,,,,,,,,,,,,,,,,,,,,,,,,,,,,,,,,,,,,SA18 2,SA18 3,,,,,,,,,,,,,,,,,,,,,,,,,,,,,,,,,,,,,,,,,,,,,,,,,75735,75735,,,,,,,,,,,,,,,,,,,,,,,,,,,,,,,,,,,,,,,,,,,,,,,,,,,,,,,,,,,,
40,Supporting the Welsh language in business and communities,Carmarthenshire County Council,SA31 1JP,,A pilot project delivering key activities to encourage businesses and community organisations to use the Welsh language.,,,"£81,600 ",1,#N/A,#N/A,2,2,23,10,,,,,,,,,,,,,,,,,,,,,,"£81,600 ",,,,,,,,,,,,,,,,,,,,,,,,,,,,,,,,,,,,,,,,,,,,,,,,,,,,,,,,,,,,,,,,,,,,,,,,,,,,,,,,,,,,,,,,,,,,,,,,,,,,,,,,,,,,,,,,,,,,,,,,,,,,,,,,,,,,,,,,,,,,,,,,,,,,,,,,,,,,,,,,,,,,,,,,,,,,,,,,,,,,,,,
41,THE LIFE YOU WANT,Carmarthenshire County Council,SA31 1JP,,"Supporting individuals to learn new skills, update existing skills, or find a new direction. The project will also offer in-depth support with job searches and living skills.",,,"£312,197 ",1,#N/A,#N/A,2,2,23,10,,,,,,,,,,,,,,,,,,,,,,"£312,197 ",,,,,,,,,,,,,,,,,,,,,,,,,,,,,,,,,,,,,,,,,,,,,,,,,,,,,,,,,,,,,,,,,,,,,,,,,,,,,,,,,,,,,,,,,,,,,,,,,,,,,,,,,,,,,,,,,,,,,,,,,,,,,,,,,,,,,,,,,,,,,,,,,,,,,,,,,,,,,,,,,,,,,,,,,,,,,,,,,,,,,,,
