122,ESP - Enterprise & Skills Pembrokeshire,Pembrokeshire County Council,SA61 1TP,,"Local skills development will create a flexible, adaptable workforce supporting entrepreneurship and businesses growth.  ESP will scope shifting market demands and future capacity requirements.  Our delivery partners will provide intensive key sector-focused skills initiatives assisting people towards economic activity and inspire and excite business innovation by removing entrepreneurship barriers.",,,"£1,388,102 ",1,#N/A,#N/A,2,3,24,9,,,,,,,,,,,,,,,,,,,,,,"£1,388,102 ",,,,,,,,,,,,,,,,,,,,,,,,,,,,,,,,,,,,,,,,,,,,,,,,,,,,,,,,,,,,,,,,,,,,,,,,,,,,,,,,,,,,,,,,,,,,,,,,,,,,,,,,,,,,,,,,,,,,,,,,,,,,,,,,,,,,,,,,,,,,,,,,,,,,,,,,,,,,,,,,,,,,,,,,,,,,,,,,,,,,,,,
123,Feasibility Study - Winter Tourism in North East Pembrokeshire,Pembrokeshire County Council,SA61 1TP,,"The Winter Tourism Feasibility Study will consider if a partnership approach can create a viable winter events programme (November to March), improve visitor footfall, create sustainable year-round tourism jobs, reduce under-employment resulting from seasonal work, especially for those with additional barriers to work, and reduce recruitment and training burdens.  ",,,"£242,835 ",1,#N/A,#N/A,2,2,23,9,,,,,,,,,,,,,,,,,,,,,,"£242,835 ",,,,,,,,,,,,,,,,,,,,,,,,,,,,,,,,,,,,,,,,,,,,,,,,,,,,,,,,,,,,,,,,,,,,,,,,,,,,,,,,,,,,,,,,,,,,,,,,,,,,,,,,,,,,,,,,,,,,,,,,,,,,,,,,,,,,,,,,,,,,,,,,,,,,,,,,,,,,,,,,,,,,,,,,,,,,,,,,,,,,,,,
124,Passion & Parking at Freshwater West - working together for a sustainable future,Pembrokeshire County Council,SA61 1TP,,"Freshwater West is Wales’ premier surfing beach. It has become exponentially busier and its popularity brings challenges for the local community, its aging infrastructure and emergency services.  This project will develop a community-led options proposal and vision for Freshwater West, including economic, access and wellbeing objectives.",,,"£61,342 ",1,#N/A,#N/A,3,3,21,,,,,,,,,,,,,,,,,,,,,,,,,,,,,,,,,,,,,,,,,,,,,Freshwater West,,,,,,,,,,,,,,,,,,,,,,,,,,,,,,,,,,,,,,,,,,,,,,,,,,SA71 5,,,,,,,,,,,,,,,,,,,,,,,,,,,,,,,,,,,,,,,,,,,,,,,,,,61342,,,,,,,,,,,,,,,,,,,,,,,,,,,,,,,,,,,,,,,,,,,,,,,,,,,,,,,,,,,,,
125,Pembrokeshire Open to All,Pembrokeshire County Council,SA61 1TP,,"The project will make Pembrokeshire an exemplary destination offering great service and facilities to disabled visitors.  The perception is that ‘accessibility’ is expensive, but simple adaptations and thoughtful customer service considerations will make a positive difference to every disabled person’s visitor experience, whilst improving profitability and lengthening the tourist season.",,,"£78,465 ",1,#N/A,#N/A,2,2,23,9,,,,,,,,,,,,,,,,,,,,,,"£78,465 ",,,,,,,,,,,,,,,,,,,,,,,,,,,,,,,,,,,,,,,,,,,,,,,,,,,,,,,,,,,,,,,,,,,,,,,,,,,,,,,,,,,,,,,,,,,,,,,,,,,,,,,,,,,,,,,,,,,,,,,,,,,,,,,,,,,,,,,,,,,,,,,,,,,,,,,,,,,,,,,,,,,,,,,,,,,,,,,,,,,,,,,
126,Resourceful Communities: Towards a wellbeing economy,Pembrokeshire County Council,SA61 1TP,,"A third sector-led consortium bid delivering a range of inclusive and intergenerational activities that contribute to a wellbeing economy and evaluating the outcomes.  The bid focuses on creating an infrastructure for community planning and investment; local food production; co-operative care opportunities, and ideas to address poverty, unemployment and digital exclusion.",,,"£522,598 ",1,#N/A,#N/A,2,3,23,9,,,,,,,,,,,,,,,,,,,,,,"£522,598 ",,,,,,,,,,,,,,,,,,,,,,,,,,,,,,,,,,,,,,,,,,,,,,,,,,,,,,,,,,,,,,,,,,,,,,,,,,,,,,,,,,,,,,,,,,,,,,,,,,,,,,,,,,,,,,,,,,,,,,,,,,,,,,,,,,,,,,,,,,,,,,,,,,,,,,,,,,,,,,,,,,,,,,,,,,,,,,,,,,,,,,,
127,Thrive Project,Pembrokeshire County Council,SA61 1TP,,"The THRIVE project will deliver Accredited Training and Business Start-Up & Growth support to 430 Businesses in Food & Hospitality, Retail, Tourism & Leisure using the THRIVE online skills platform and Blended Advisory Support. We will support 270 individuals aged 16 – 65 to achieve L2 Qualifications to access employment opportunities.",,,"£316,950 ",1,#N/A,#N/A,2,2,21,9,,,,,,,,,,,,,,,,,,,,,,"£316,950 ",,,,,,,,,,,,,,,,,,,,,,,,,,,,,,,,,,,,,,,,,,,,,,,,,,,,,,,,,,,,,,,,,,,,,,,,,,,,,,,,,,,,,,,,,,,,,,,,,,,,,,,,,,,,,,,,,,,,,,,,,,,,,,,,,,,,,,,,,,,,,,,,,,,,,,,,,,,,,,,,,,,,,,,,,,,,,,,,,,,,,,,
128,Enterprise Powys,Powys County Council,LD1 5LG,,"Focus Enterprise Powys offers a pre-start entrepreneurship pathway for 100 individuals. Activity includes: Tailored, holistic support 121's/small-group webinars Developing entrepreneurial skills/confidence Progressing business plans And resilience support for 50 existing small businesses: Video-conferenced 121s supporting with finances, social media, export, diversification Linking to virtual networks/advisory webinars Bursary for clean, early stage businesses",,,"£217,389 ",1,#N/A,#N/A,2,2,23,7,,,,,,,,,,,,,,,,,,,,,,"£217,389 ",,,,,,,,,,,,,,,,,,,,,,,,,,,,,,,,,,,,,,,,,,,,,,,,,,,,,,,,,,,,,,,,,,,,,,,,,,,,,,,,,,,,,,,,,,,,,,,,,,,,,,,,,,,,,,,,,,,,,,,,,,,,,,,,,,,,,,,,,,,,,,,,,,,,,,,,,,,,,,,,,,,,,,,,,,,,,,,,,,,,,,,Unclear information on visibility
129,Green Heart of Wales/Zero Carbon Mid Wales,Powys County Council,LD1 5LG,,"The Centre for Alternative Technology and partners will deliver four feasibility studies, test innovative retrofit training approaches and an Energy Services Company model, with the purpose of robustly demonstrating the investment opportunities to contribute to economic growth and a net zero carbon future in the UK.",,,"£523,962 ",1,#N/A,#N/A,2,2,23,7,,,,,,,,,,,,,,,,,,,,,,"£523,962 ",,,,,,,,,,,,,,,,,,,,,,,,,,,,,,,,,,,,,,,,,,,,,,,,,,,,,,,,,,,,,,,,,,,,,,,,,,,,,,,,,,,,,,,,,,,,,,,,,,,,,,,,,,,,,,,,,,,,,,,,,,,,,,,,,,,,,,,,,,,,,,,,,,,,,,,,,,,,,,,,,,,,,,,,,,,,,,,,,,,,,,,
130,Montgomery Canal restoration feasibility,Powys County Council,LD1 5LG,,"The project comprises a feasibility study, preparatory assessments, investigations, and designs, with the focus on waterway (restoration) for economic & social purposes. Activity includes infrastructure works required to open the Montgomery Canal to navigation; a 4.4mile section from the border at Llanymynech to Arddleen and to connect to the 12 miles already restored section each side of Welshpool. [From main project description]",,,"£336,666 ",1,#N/A,#N/A,3,2,21,,,,,,,,,,,,,,,,,,,,,,,,,,,,,,,,,,,,,,,,,,,,,Meifod,Llanymynech,Llanfyllin,Pant,Talerddig,Llanidloes,Westbury,,,,,,,,,,,,,,,,,,,,,,,,,,,,,,,,,,,,,,,,,,,,SY22 6,SY10 9,SY22 5,SY10 8,SY21 9,SY21 8,SY5 9,,,,,,,,,,,,,,,,,,,,,,,,,,,,,,,,,,,,,,,,,,,,48095.19,48095.19,48095.19,48095.19,48095.19,48095.19,48095.19,,,,,,,,,,,,,,,,,,,,,,,,,,,,,,,,,,,,,,,,,,,,,,,,,,,,,,,
131,Powys Community Skills Initiative,Powys County Council,LD1 5LG,,"Through training and pilot schemes, we will improve skills, provide service improvement opportunities, develop an effective skills network and digitally future proof citizens and organisations in Powys.",,,"£764,863 ",1,#N/A,#N/A,2,3,23,7,,,,,,,,,,,,,,,,,,,,,,"£764,863 ",,,,,,,,,,,,,,,,,,,,,,,,,,,,,,,,,,,,,,,,,,,,,,,,,,,,,,,,,,,,,,,,,,,,,,,,,,,,,,,,,,,,,,,,,,,,,,,,,,,,,,,,,,,,,,,,,,,,,,,,,,,,,,,,,,,,,,,,,,,,,,,,,,,,,,,,,,,,,,,,,,,,,,,,,,,,,,,,,,,,,,,
132,Powys County Council - Go Green To Get Clean.,Powys County Council,LD1 5LG,,"This pilot will test the feasibility of introducing electric road sweepers across the county as part of a wider strategy to reduce carbon emissions. This project will enhance environmental conditions by reducing air and noise pollution and so, improve the quality of place for communities, businesses, and visitors alike.",,,"£408,000 ",1,#N/A,#N/A,2,2,23,7,,,,,,,,,,,,,,,,,,,,,,"£408,000 ",,,,,,,,,,,,,,,,,,,,,,,,,,,,,,,,,,,,,,,,,,,,,,,,,,,,,,,,,,,,,,,,,,,,,,,,,,,,,,,,,,,,,,,,,,,,,,,,,,,,,,,,,,,,,,,,,,,,,,,,,,,,,,,,,,,,,,,,,,,,,,,,,,,,,,,,,,,,,,,,,,,,,,,,,,,,,,,,,,,,,,,
133,Powys Localities Initiative,Powys County Council,LD1 5LG,,"During the Coronavirus pandemic, PAVO set up 13 'locality' networks across Powys as a way for 3rd sector organisations to engage with both the immediate needs and the post pandemic aspirations of the market towns of the county, and of the residents of the rural hinterland reliant upon the services that they provide. This project builds on work to date to develop the networks as forums that build the capacity of residents to plan, develop and deliver activities that boost the social and economic vitality of each locality. In addition to facilitating discussion on development priorities, the project will provide funding to each locality to take forward activities that can inform the creation of future initiatives or pilot activities that enhance resilience in each locality.",,,"£428,232 ",1,#N/A,#N/A,2,3,23,7,,,,,,,,,,,,,,,,,,,,,,"£428,232 ",,,,,,,,,,,,,,,,,,,,,,,,,,,,,,,,,,,,,,,,,,,,,,,,,,,,,,,,,,,,,,,,,,,,,,,,,,,,,,,,,,,,,,,,,,,,,,,,,,,,,,,,,,,,,,,,,,,,,,,,,,,,,,,,,,,,,,,,,,,,,,,,,,,,,,,,,,,,,,,,,,,,,,,,,,,,,,,,,,,,,,,
134,Connecting Teachers with Industry,Rhondda Cynon Taf County Borough Council,CF40 2XX,,"The Connecting Teachers with Industry Project is an excellent opportunity for teachers and students from schools in the Bridgend and Rhondda Cynon Taf local authorities, to find out about the exciting careers available in the Science, Technology, Engineering, Arts and Math (STEAM) sectors in Wales.",,,"£89,899 ",1,#N/A,#N/A,2,2,21,14,,,,,,,,,,,,,,,,,,,,,,"£89,899 ",,,,,,,,,,,,,,,,,,,,,,,,,,,,,,,,,,,,,,,,,,,,,,,,,,,,,,,,,,,,,,,,,,,,,,,,,,,,,,,,,,,,,,,,,,,,,,,,,,,,,,,,,,,,,,,,,,,,,,,,,,,,,,,,,,,,,,,,,,,,,,,,,,,,,,,,,,,,,,,,,,,,,,,,,,,,,,,,,,,,,,,
135,Focus Enterprise RCT,Rhondda Cynon Taf County Borough Council,CF40 2XX,,"Supporting economically inactive / unemployed / furloughed individuals into self-employment.  Investment in digital, employability and entrepreneurial skills, support newly established micro-businesses and supplement mainstream provision, working closely with community partners.  The project supports financial literacy, working with Credit Unions.  50 established businesses will be supported with recover/ resilience as they deal with COVID challenges.",,,"£217,389 ",1,#N/A,#N/A,2,2,23,14,,,,,,,,,,,,,,,,,,,,,,"£217,389 ",,,,,,,,,,,,,,,,,,,,,,,,,,,,,,,,,,,,,,,,,,,,,,,,,,,,,,,,,,,,,,,,,,,,,,,,,,,,,,,,,,,,,,,,,,,,,,,,,,,,,,,,,,,,,,,,,,,,,,,,,,,,,,,,,,,,,,,,,,,,,,,,,,,,,,,,,,,,,,,,,,,,,,,,,,,,,,,,,,,,,,,
136,Heal Your High Street,Rhondda Cynon Taf County Borough Council,CF40 2XX,,"Create, manage and facilitate a co-working space / community hub and tourist information in Aberdare town centre, which will deliver a variety of innovative workshops, activities and events to business.  Distribution of 10x £10,000 grants to local businesses to help support micro-economic stimulation and develop new products and services related to sustainable food and climate change. ",,,"£624,121 ",1,#N/A,#N/A,3,3,23,,,,,,,,,,,,,,,,,,,,,,,,,,,,,,,,,,,,,,,,,,,,,Aberdare,Aberdare,Aberdare,,,,,,,,,,,,,,,,,,,,,,,,,,,,,,,,,,,,,,,,,,,,,,,,CF44 0,CF44 6,CF44 8,,,,,,,,,,,,,,,,,,,,,,,,,,,,,,,,,,,,,,,,,,,,,,,,208040.24,208040.24,208040.24,,,,,,,,,,,,,,,,,,,,,,,,,,,,,,,,,,,,,,,,,,,,,,,,,,,,,,,,,,,
137,Ideas to Innovation (I2I),Rhondda Cynon Taf County Borough Council,CF40 2XX,,Ideas to Innovation (i2i) has been designed for ambitious individuals looking to unlock their entrepreneurial and creative potential. This programme encourages research students to consider the social and economic relevance of their research.,,,"£559,526 ",1,#N/A,#N/A,2,2,23,14,,,,,,,,,,,,,,,,,,,,,,"£559,526 ",,,,,,,,,,,,,,,,,,,,,,,,,,,,,,,,,,,,,,,,,,,,,,,,,,,,,,,,,,,,,,,,,,,,,,,,,,,,,,,,,,,,,,,,,,,,,,,,,,,,,,,,,,,,,,,,,,,,,,,,,,,,,,,,,,,,,,,,,,,,,,,,,,,,,,,,,,,,,,,,,,,,,,,,,,,,,,,,,,,,,,,
138,Improving Deaf Awareness and supporting people with hearing loss in the Community,Rhondda Cynon Taf County Borough Council,CF40 2XX,,"Delivery of Deaf Awareness training and basic British Sign Language to customer facing staff at range of businesses and organisations. Extend local community groups to relieve loneliness and isolation.  New groups in sheltered homes, helping residents and relieving pressure on care home staff.  Groups will be fully constituted, self-sufficient and sustainable after March 2022. ",,,"£67,626 ",1,#N/A,#N/A,2,2,23,14,,,,,,,,,,,,,,,,,,,,,,"£67,626 ",,,,,,,,,,,,,,,,,,,,,,,,,,,,,,,,,,,,,,,,,,,,,,,,,,,,,,,,,,,,,,,,,,,,,,,,,,,,,,,,,,,,,,,,,,,,,,,,,,,,,,,,,,,,,,,,,,,,,,,,,,,,,,,,,,,,,,,,,,,,,,,,,,,,,,,,,,,,,,,,,,,,,,,,,,,,,,,,,,,,,,,
139,RCT 360,Rhondda Cynon Taf County Borough Council,CF40 2XX,,"Through tailored support and advice, RCT 360 supports people in Rhondda Cynon Taff to overcome the challenges they may face.   RCT 360 is a collaboration between Artis Community Cymuned, Mental Health Wales, Sgiliau and Volunteering Matters, designed to remove barriers to opportunities and employment by offering tailored support, advice and mentoring.",,,"£597,937 ",1,#N/A,#N/A,2,3,23,14,,,,,,,,,,,,,,,,,,,,,,"£597,937 ",,,,,,,,,,,,,,,,,,,,,,,,,,,,,,,,,,,,,,,,,,,,,,,,,,,,,,,,,,,,,,,,,,,,,,,,,,,,,,,,,,,,,,,,,,,,,,,,,,,,,,,,,,,,,,,,,,,,,,,,,,,,,,,,,,,,,,,,,,,,,,,,,,,,,,,,,,,,,,,,,,,,,,,,,,,,,,,,,,,,,,,
140,Reconnect Youth Project,Rhondda Cynon Taf County Borough Council,CF40 2XX,,"Expansion of existing projects together with two new projects: working with YEPS to create an allotment, developing outdoor space and linking with sustainable food and healthy eating projects for children and parents; and working with Ysgol Nantgwyn pupils to plan and deliver youth sessions as part of the Welsh Baccalaureate. ",,,"£53,006 ",1,#N/A,#N/A,3,3,23,,,,,,,,,,,,,,,,,,,,,,,,,,,,,,,,,,,,,,,,,,,,,Tonypandy,,,,,,,,,,,,,,,,,,,,,,,,,,,,,,,,,,,,,,,,,,,,,,,,,,CF40 1,,,,,,,,,,,,,,,,,,,,,,,,,,,,,,,,,,,,,,,,,,,,,,,,,,53006,,,,,,,,,,,,,,,,,,,,,,,,,,,,,,,,,,,,,,,,,,,,,,,,,,,,,,,,,,,,,Have coded to local school
141,Community-led Sustainable Transport Solutions - Investing in Communities and Place,Swansea Council,SA1 3SN,,"This proposed a programme of activities to strengthen sustainable transport and active travel in Swansea, with a focus on what communities can do for themselves. Community consultation activities linked to the project started in January 2022 with ‘Getting Around Swansea’ project branding. ",,,"£128,821 ",1,#N/A,#N/A,2,3,23,11,,,,,,,,,,,,,,,,,,,,,,"£128,821 ",,,,,,,,,,,,,,,,,,,,,,,,,,,,,,,,,,,,,,,,,,,,,,,,,,,,,,,,,,,,,,,,,,,,,,,,,,,,,,,,,,,,,,,,,,,,,,,,,,,,,,,,,,,,,,,,,,,,,,,,,,,,,,,,,,,,,,,,,,,,,,,,,,,,,,,,,,,,,,,,,,,,,,,,,,,,,,,,,,,,,,,
142,Cowork Local (Swansea),Swansea Council,SA1 3SN,,"With evolving changes to the world of work, some are looking to escape the challenges of working from home whilst others hope to boot the commute. Cowork Local seeks to provide the best of both worlds, combining amazing work spaces, with convenient locations close to where people live.",,,"£331,891 ",1,#N/A,#N/A,2,3,20,11,,,,,,,,,,,,,,,,,,,,,,"£331,891 ",,,,,,,,,,,,,,,,,,,,,,,,,,,,,,,,,,,,,,,,,,,,,,,,,,,,,,,,,,,,,,,,,,,,,,,,,,,,,,,,,,,,,,,,,,,,,,,,,,,,,,,,,,,,,,,,,,,,,,,,,,,,,,,,,,,,,,,,,,,,,,,,,,,,,,,,,,,,,,,,,,,,,,,,,,,,,,,,,,,,,,,Could be specific local projects but clearly operate across whole county
143,Dragon Energy Island - Swansea Bay Tidal Lagoon,Swansea Council,SA1 3SN,,Funding to develop a business case for a tidal lagoon with floating houses and a solar farm.,,,"£202,650 ",1,#N/A,#N/A,3,3,21,,,,,,,,,,,,,,,,,,,,,,,,,,,,,,,,,,,,,,,,,,,,,Swansea,Swansea,,,,,,,,,,,,,,,,,,,,,,,,,,,,,,,,,,,,,,,,,,,,,,,,,SA1 1,SA1 8,,,,,,,,,,,,,,,,,,,,,,,,,,,,,,,,,,,,,,,,,,,,,,,,,101325.2,101325.2,,,,,,,,,,,,,,,,,,,,,,,,,,,,,,,,,,,,,,,,,,,,,,,,,,,,,,,,,,,,
144,Enterprise Swansea,Swansea Council,SA1 3SN,,Supporting people going in to self-employment.,,,"£199,734 ",1,#N/A,#N/A,2,2,23,11,,,,,,,,,,,,,,,,,,,,,,"£199,734 ",,,,,,,,,,,,,,,,,,,,,,,,,,,,,,,,,,,,,,,,,,,,,,,,,,,,,,,,,,,,,,,,,,,,,,,,,,,,,,,,,,,,,,,,,,,,,,,,,,,,,,,,,,,,,,,,,,,,,,,,,,,,,,,,,,,,,,,,,,,,,,,,,,,,,,,,,,,,,,,,,,,,,,,,,,,,,,,,,,,,,,,Unclear information on visibility
145,Pathways to Work Swansea,Swansea Council,SA1 3SN,,"Open to local residents who are either long-term unemployed or aged 16-plus and economically inactive. It offers employability support, support for improving skills (including digital skills), volunteering and paid placements.",,,"£764,444 ",1,#N/A,#N/A,2,2,23,11,,,,,,,,,,,,,,,,,,,,,,"£764,444 ",,,,,,,,,,,,,,,,,,,,,,,,,,,,,,,,,,,,,,,,,,,,,,,,,,,,,,,,,,,,,,,,,,,,,,,,,,,,,,,,,,,,,,,,,,,,,,,,,,,,,,,,,,,,,,,,,,,,,,,,,,,,,,,,,,,,,,,,,,,,,,,,,,,,,,,,,,,,,,,,,,,,,,,,,,,,,,,,,,,,,,,
146,Penderi Green Regeneration,Swansea Council,SA1 3SN,,"The Penderi Regeneration Scheme will involve a large and long-term investment into the area, four miles from Swansea city centre. There is a focus seven core ambitions, including integrated blue green infrastructure, a connected and accessible neighbourhood, high quality building stock, community facilties and provisions, active and involved communitty, energy efficiency and economically resilient neighbourhood.",,,"£223,029 ",1,#N/A,#N/A,3,3,23,,,,,,,,,,,,,,,,,,,,,,,,,,,,,,,,,,,,,,,,,,,,,Penderi,Penderi,Penderi,,,,,,,,,,,,,,,,,,,,,,,,,,,,,,,,,,,,,,,,,,,,,,,,SA5 5,SA5 7,SA5 4,,,,,,,,,,,,,,,,,,,,,,,,,,,,,,,,,,,,,,,,,,,,,,,,74342.98,74342.98,74342.98,,,,,,,,,,,,,,,,,,,,,,,,,,,,,,,,,,,,,,,,,,,,,,,,,,,,,,,,,,,
147,People with Disabilities Employability and Enterprise Project (Swansea Project),Swansea Council,SA1 3SN,,No details found,,,"£139,855 ",0,#N/A,#N/A,,,,,,,,,,,,,,,,,,,,,,,,,,,,,,,,,,,,,,,,,,,,,,,,,,,,,,,,,,,,,,,,,,,,,,,,,,,,,,,,,,,,,,,,,,,,,,,,,,,,,,,,,,,,,,,,,,,,,,,,,,,,,,,,,,,,,,,,,,,,,,,,,,,,,,,,,,,,,,,,,,,,,,,,,,,,,,,,,,,,,,,,,,,,,,,,,,,,,,,,,,,,,,,,,
148,Swansea Business Support and Green Recovery,Swansea Council,SA1 3SN,,"The project icludes many different elements including training, events, conferences, advice and support for businesses and individuals across Swansea.",,,"£583,766 ",1,#N/A,#N/A,2,2,23,11,,,,,,,,,,,,,,,,,,,,,,"£583,766 ",,,,,,,,,,,,,,,,,,,,,,,,,,,,,,,,,,,,,,,,,,,,,,,,,,,,,,,,,,,,,,,,,,,,,,,,,,,,,,,,,,,,,,,,,,,,,,,,,,,,,,,,,,,,,,,,,,,,,,,,,,,,,,,,,,,,,,,,,,,,,,,,,,,,,,,,,,,,,,,,,,,,,,,,,,,,,,,,,,,,,,,
149,Time to Learn and Work,Swansea Council,SA1 3SN,,No details found,,,"£94,131 ",0,#N/A,#N/A,,,,,,,,,,,,,,,,,,,,,,,,,,,,,,,,,,,,,,,,,,,,,,,,,,,,,,,,,,,,,,,,,,,,,,,,,,,,,,,,,,,,,,,,,,,,,,,,,,,,,,,,,,,,,,,,,,,,,,,,,,,,,,,,,,,,,,,,,,,,,,,,,,,,,,,,,,,,,,,,,,,,,,,,,,,,,,,,,,,,,,,,,,,,,,,,,,,,,,,,,,,,,,,,,
150,A Complete Digital Package for Torfaen Businesses,Torfaen County Borough Council,NP4 6YB,,"Uddr received UK Community Renewal Funding to help 200 Torfaen businesses build their digital footprint. The project offers companies the chance to benefit from a fully-funded website for 12 months and a year-long subscription to the Uddr app, which promotes local businesses, trades and services.",,,"£385,560 ",1,#N/A,#N/A,2,2,23,18,,,,,,,,,,,,,,,,,,,,,,"£385,560 ",,,,,,,,,,,,,,,,,,,,,,,,,,,,,,,,,,,,,,,,,,,,,,,,,,,,,,,,,,,,,,,,,,,,,,,,,,,,,,,,,,,,,,,,,,,,,,,,,,,,,,,,,,,,,,,,,,,,,,,,,,,,,,,,,,,,,,,,,,,,,,,,,,,,,,,,,,,,,,,,,,,,,,,,,,,,,,,,,,,,,,,
151,"CELT (Connect, Engage, Listen, Transform)",Torfaen County Borough Council,NP4 6YB,,The CELT research project aims to trial new techniques and interventions to support the long-term unemployed into work across 10 local authorities in South Wales.,,,"£1,927,860 ",1,#N/A,#N/A,2,2,23,18,17,13,16,21,15,19,20,14,22,,,,,,,,,,,,,"£192,786 ","£192,786 ","£192,786 ","£192,786 ","£192,786 ","£192,786 ","£192,786 ","£192,786 ","£192,786 ","£192,786 ",,,,,,,,,,,,,,,,,,,,,,,,,,,,,,,,,,,,,,,,,,,,,,,,,,,,,,,,,,,,,,,,,,,,,,,,,,,,,,,,,,,,,,,,,,,,,,,,,,,,,,,,,,,,,,,,,,,,,,,,,,,,,,,,,,,,,,,,,,,,,,,,,,,,,,,,,,,,,,,,,,,,,,,,,,,,,,
152,Food 4 Growth,Torfaen County Borough Council,NP4 6YB,,"Food4Growth is a cooperation project between Torfaen, Caerphilly and Monmouthshire councils and aims to find new ways to help develop food supply chains and create a whole system approach. The project’s Rural Business Scheme aims to support 12 rural businesses to add value to their produce, such as diversifying or looking at new processes like vertical growing and pick your own schemes.",,,"£618,403 ",1,#N/A,#N/A,2,2,21,18,16,19,,,,,,,,,,,,,,,,,,,,"£206,134.32 ","£206,134.32 ","£206,134.32 ",,,,,,,,,,,,,,,,,,,,,,,,,,,,,,,,,,,,,,,,,,,,,,,,,,,,,,,,,,,,,,,,,,,,,,,,,,,,,,,,,,,,,,,,,,,,,,,,,,,,,,,,,,,,,,,,,,,,,,,,,,,,,,,,,,,,,,,,,,,,,,,,,,,,,,,,,,,,,,,,,,,,,,,,,,,,,,,,,,,,,
153,Pontypool & Blaenavon Small Business Support Project,Torfaen County Borough Council,NP4 6YB,,"Promoting start-ups ups and business-to-business purchasing in Pontypool and Blaenavon will be one of the focuses of this project. It will also develop a skills swap platform to support new businesses, trial opportunities for short-term premises and work with landlords to bring empty buildings back into use.",,,"£154,494 ",1,#N/A,#N/A,3,2,23,,,,,,,,,,,,,,,,,,,,,,,,,,,,,,,,,,,,,,,,,,,,,Pontypool,Pontypool,Pontypool,Blaenavon,,,,,,,,,,,,,,,,,,,,,,,,,,,,,,,,,,,,,,,,,,,,,,,NP4 5,NP4 8,NP4 6,NP4 9,,,,,,,,,,,,,,,,,,,,,,,,,,,,,,,,,,,,,,,,,,,,,,,38623.51,38623.51,38623.51,38623.51,,,,,,,,,,,,,,,,,,,,,,,,,,,,,,,,,,,,,,,,,,,,,,,,,,,,,,,,,,
154,Stepping Stones,Torfaen County Borough Council,NP4 6YB,,"The project is aimed at the over 50s who want to learn new skills or develop a new interest. It features 12 workshops that cover areas including growing your own produce in an allotment, jewellery making, ceramics, cake decorating, growing your own produce in an allotment, and the repair shop, which is geared towards upcycling and DIY services.",,,"£338,038 ",1,#N/A,#N/A,2,3,23,18,,,,,,,,,,,,,,,,,,,,,,"£338,038 ",,,,,,,,,,,,,,,,,,,,,,,,,,,,,,,,,,,,,,,,,,,,,,,,,,,,,,,,,,,,,,,,,,,,,,,,,,,,,,,,,,,,,,,,,,,,,,,,,,,,,,,,,,,,,,,,,,,,,,,,,,,,,,,,,,,,,,,,,,,,,,,,,,,,,,,,,,,,,,,,,,,,,,,,,,,,,,,,,,,,,,,
155,THE LIFE YOU WANT,Torfaen County Borough Council,NP4 6YB,,"The charity Threshold DAS is offering anyone over the age of 16 the chance to study for a range of work-related and personal and social qualifications. The money from the Community Renewal Fund will cover the cost of 150 qualifications, plus 30 places for young people, aged between 16-25, to learn life skills.",,,"£204,300 ",1,#N/A,#N/A,2,2,23,18,,,,,,,,,,,,,,,,,,,,,,"£204,300 ",,,,,,,,,,,,,,,,,,,,,,,,,,,,,,,,,,,,,,,,,,,,,,,,,,,,,,,,,,,,,,,,,,,,,,,,,,,,,,,,,,,,,,,,,,,,,,,,,,,,,,,,,,,,,,,,,,,,,,,,,,,,,,,,,,,,,,,,,,,,,,,,,,,,,,,,,,,,,,,,,,,,,,,,,,,,,,,,,,,,,,,
156,Young Enterprise Torfaen,Torfaen County Borough Council,NP4 6YB,,"Business in Focus’ Focus Futures initiative aims to support young people, aged between 16 and 24, overcome barriers to employment and develop the confidence and skills they need to reach their potential. It will provide guidance to people looking to start their own business, help them access financial support and provide training and 1-2-1 guidance.",,,"£232,689 ",1,#N/A,#N/A,2,3,23,18,,,,,,,,,,,,,,,,,,,,,,"£232,689 ",,,,,,,,,,,,,,,,,,,,,,,,,,,,,,,,,,,,,,,,,,,,,,,,,,,,,,,,,,,,,,,,,,,,,,,,,,,,,,,,,,,,,,,,,,,,,,,,,,,,,,,,,,,,,,,,,,,,,,,,,,,,,,,,,,,,,,,,,,,,,,,,,,,,,,,,,,,,,,,,,,,,,,,,,,,,,,,,,,,,,,,
157,Barry Bands Together - Community Regeneration through Musical Partnership,Vale of Glamorgan Council,CF63 4RU,,To support community regeneration through musical partnership. This will be paid out as a grant to Cardiff County and the Vale of Glamorgan Music Service.  The grant is to refurbish the Vale of Glamorgan brass band premises as the music hub for the community. ,,,"£124,437 ",1,#N/A,#N/A,3,3,23,,,,,,,,,,,,,,,,,,,,,,,,,,,,,,,,,,,,,,,,,,,,,Barry,,,,,,,,,,,,,,,,,,,,,,,,,,,,,,,,,,,,,,,,,,,,,,,,,,CF62 5,,,,,,,,,,,,,,,,,,,,,,,,,,,,,,,,,,,,,,,,,,,,,,,,,,124437,,,,,,,,,,,,,,,,,,,,,,,,,,,,,,,,,,,,,,,,,,,,,,,,,,,,,,,,,,,,,
158,Cowork Local (Vale of Glamorgan),Vale of Glamorgan Council,CF63 4RU,,"With evolving changes to the world of work, some are looking to escape the challenges of working from home whilst others hope to boot the commute. Cowork Local seeks to provide the best of both worlds, combining amazing work spaces, with convenient locations close to where people live.",,,"£453,849 ",1,#N/A,#N/A,2,3,20,22,,,,,,,,,,,,,,,,,,,,,,"£453,849 ",,,,,,,,,,,,,,,,,,,,,,,,,,,,,,,,,,,,,,,,,,,,,,,,,,,,,,,,,,,,,,,,,,,,,,,,,,,,,,,,,,,,,,,,,,,,,,,,,,,,,,,,,,,,,,,,,,,,,,,,,,,,,,,,,,,,,,,,,,,,,,,,,,,,,,,,,,,,,,,,,,,,,,,,,,,,,,,,,,,,,,,
159,Enterprise Vale,Vale of Glamorgan Council,CF63 4RU,,Supporting people going in to self-employment.,,,"£106,867 ",1,#N/A,#N/A,2,2,23,22,,,,,,,,,,,,,,,,,,,,,,"£106,867 ",,,,,,,,,,,,,,,,,,,,,,,,,,,,,,,,,,,,,,,,,,,,,,,,,,,,,,,,,,,,,,,,,,,,,,,,,,,,,,,,,,,,,,,,,,,,,,,,,,,,,,,,,,,,,,,,,,,,,,,,,,,,,,,,,,,,,,,,,,,,,,,,,,,,,,,,,,,,,,,,,,,,,,,,,,,,,,,,,,,,,,,Unclear information on visibility
160,Foundational Economy - Innovation in Procurement.,Vale of Glamorgan Council,CF63 4RU,,The Foundational Economy Challenge Fund is a Welsh Government initiative with its key aim to re-focus policy on the infrastructure supporting everyday business and life.,,,"£77,643 ",1,#N/A,#N/A,2,2,8,22,,,,,,,,,,,,,,,,,,,,,,"£77,643 ",,,,,,,,,,,,,,,,,,,,,,,,,,,,,,,,,,,,,,,,,,,,,,,,,,,,,,,,,,,,,,,,,,,,,,,,,,,,,,,,,,,,,,,,,,,,,,,,,,,,,,,,,,,,,,,,,,,,,,,,,,,,,,,,,,,,,,,,,,,,,,,,,,,,,,,,,,,,,,,,,,,,,,,,,,,,,,,,,,,,,,,
161,Priority Sector Skills Academies,Vale of Glamorgan Council,CF63 4RU,,Full-time intensive upskilling courses designed to meet the needs of local industry. ,,,"£147,141 ",1,#N/A,#N/A,3,2,20,,,,,,,,,,,,,,,,,,,,,,,,,,,,,,,,,,,,,,,,,,,,,Cardiff,,,,,,,,,,,,,,,,,,,,,,,,,,,,,,,,,,,,,,,,,,,,,,,,,,CF3 1,,,,,,,,,,,,,,,,,,,,,,,,,,,,,,,,,,,,,,,,,,,,,,,,,,147141,,,,,,,,,,,,,,,,,,,,,,,,,,,,,,,,,,,,,,,,,,,,,,,,,,,,,,,,,,,,,
