42,AberInnovation Productivity Accelerator,Ceredigion County Council,SY23 3UE,,"AberInnovation’s productivity accelerator “Productivity 2 Prosperity” is a four month, UK-funded pilot project ending in August 2022. The fully funded pilot will deliver manufacturing, productivity and enterprise support and guidance to businesses in the food and drink, biotechnology, and agritech sectors in Ceredigion.",,,"£450,330 ",1,#N/A,#N/A,2,2,23,8,,,,,,,,,,,,,,,,,,,,,,"£450,330 ",,,,,,,,,,,,,,,,,,,,,,,,,,,,,,,,,,,,,,,,,,,,,,,,,,,,,,,,,,,,,,,,,,,,,,,,,,,,,,,,,,,,,,,,,,,,,,,,,,,,,,,,,,,,,,,,,,,,,,,,,,,,,,,,,,,,,,,,,,,,,,,,,,,,,,,,,,,,,,,,,,,,,,,,,,,,,,,,,,,,,,,
43,AnTir Feasibility Project,Ceredigion County Council,SY23 3UE,,"Wildlife gardening and organic food growing, and developed accredited learning units for them. We also trialled a garden-based volunteer programme.",,,"£170,261 ",1,#N/A,#N/A,3,2,23,,,,,,,,,,,,,,,,,,,,,,,,,,,,,,,,,,,,,,,,,,,,,Llanfarian,,,,,,,,,,,,,,,,,,,,,,,,,,,,,,,,,,,,,,,,,,,,,,,,,,SY23 4,,,,,,,,,,,,,,,,,,,,,,,,,,,,,,,,,,,,,,,,,,,,,,,,,,170261,,,,,,,,,,,,,,,,,,,,,,,,,,,,,,,,,,,,,,,,,,,,,,,,,,,,,,,,,,,,,May apply to areas outside the garden
44,BioAccelerate,Ceredigion County Council,SY23 3UE,,"BioAccelerate is a business accelerator programme designed to help you bring your innovative idea to fruition. Applications are now open to individuals or groups who wish to develop a new product or service in the bioscience, healthcare, agri-tech or food and drink sectors. ",,,"£218,331 ",1,#N/A,#N/A,2,2,23,8,,,,,,,,,,,,,,,,,,,,,,"£218,331 ",,,,,,,,,,,,,,,,,,,,,,,,,,,,,,,,,,,,,,,,,,,,,,,,,,,,,,,,,,,,,,,,,,,,,,,,,,,,,,,,,,,,,,,,,,,,,,,,,,,,,,,,,,,,,,,,,,,,,,,,,,,,,,,,,,,,,,,,,,,,,,,,,,,,,,,,,,,,,,,,,,,,,,,,,,,,,,,,,,,,,,,
45,Building the Resilience of Historic Visitor Attractions By Developing Volunteer Ability,Ceredigion County Council,SY23 3UE,,No details found,,,"£7,191 ",0,#N/A,#N/A,,,,,,,,,,,,,,,,,,,,,,,,,,,,,,,,,,,,,,,,,,,,,,,,,,,,,,,,,,,,,,,,,,,,,,,,,,,,,,,,,,,,,,,,,,,,,,,,,,,,,,,,,,,,,,,,,,,,,,,,,,,,,,,,,,,,,,,,,,,,,,,,,,,,,,,,,,,,,,,,,,,,,,,,,,,,,,,,,,,,,,,,,,,,,,,,,,,,,,,,,,,,,,,,,
46,Canolfan Tir Glas,Ceredigion County Council,SY23 3UE,,"Regeneration of Lampeter town. The development will stimulate economic, social and cultural activity in the area by injecting new life and energy into the town.",,,"£497,760 ",1,Canolfan Tir Glas,#N/A,3,3,20,,,,,,,,,,,,,,,,,,,,,,,,,,,,,,,,,,,,,,,,,,,,,Lampeter,Lampeter,,,,,,,,,,,,,,,,,,,,,,,,,,,,,,,,,,,,,,,,,,,,,,,,,SA48 8,SA48 7,,,,,,,,,,,,,,,,,,,,,,,,,,,,,,,,,,,,,,,,,,,,,,,,,248880,248880,,,,,,,,,,,,,,,,,,,,,,,,,,,,,,,,,,,,,,,,,,,,,,,,,,,,,,,,,,,,
47,Enabling the Recovery of Ceredigion Towns,Ceredigion County Council,SY23 3UE,,No details found,,,"£244,703 ",0,#N/A,#N/A,,,,,,,,,,,,,,,,,,,,,,,,,,,,,,,,,,,,,,,,,,,,,,,,,,,,,,,,,,,,,,,,,,,,,,,,,,,,,,,,,,,,,,,,,,,,,,,,,,,,,,,,,,,,,,,,,,,,,,,,,,,,,,,,,,,,,,,,,,,,,,,,,,,,,,,,,,,,,,,,,,,,,,,,,,,,,,,,,,,,,,,,,,,,,,,,,,,,,,,,,,,,,,,,,
48,Enterprise Ceredigion,Ceredigion County Council,SY23 3UE,,Supporting people going in to self-employment.,,,"£217,389 ",1,#N/A,#N/A,2,2,23,8,,,,,,,,,,,,,,,,,,,,,,"£217,389 ",,,,,,,,,,,,,,,,,,,,,,,,,,,,,,,,,,,,,,,,,,,,,,,,,,,,,,,,,,,,,,,,,,,,,,,,,,,,,,,,,,,,,,,,,,,,,,,,,,,,,,,,,,,,,,,,,,,,,,,,,,,,,,,,,,,,,,,,,,,,,,,,,,,,,,,,,,,,,,,,,,,,,,,,,,,,,,,,,,,,,,,Unclear information on visibility
49,Lle i Weithio,Ceredigion County Council,SY23 3UE,,A pilot project forming a group of like-minded employers to collectively explore and trial initiatives to enhance job creation and retention of younger generations in Ceredigion.,,,"£101,550 ",1,#N/A,#N/A,2,2,23,8,,,,,,,,,,,,,,,,,,,,,,"£101,550 ",,,,,,,,,,,,,,,,,,,,,,,,,,,,,,,,,,,,,,,,,,,,,,,,,,,,,,,,,,,,,,,,,,,,,,,,,,,,,,,,,,,,,,,,,,,,,,,,,,,,,,,,,,,,,,,,,,,,,,,,,,,,,,,,,,,,,,,,,,,,,,,,,,,,,,,,,,,,,,,,,,,,,,,,,,,,,,,,,,,,,,,
50,Mid Wales Challenge Led Launch Pad Series,Ceredigion County Council,SY23 3UE,,Programme aimed at developing novel solutions to public sector and societal issues through research and innovation whilst offering new market opportunities for businesses and low skilled people in mid Wales.,,,"£565,789 ",1,#N/A,#N/A,2,2,23,8,7,,,,,,,,,,,,,,,,,,,,,"£282,894 ","£282,894 ",,,,,,,,,,,,,,,,,,,,,,,,,,,,,,,,,,,,,,,,,,,,,,,,,,,,,,,,,,,,,,,,,,,,,,,,,,,,,,,,,,,,,,,,,,,,,,,,,,,,,,,,,,,,,,,,,,,,,,,,,,,,,,,,,,,,,,,,,,,,,,,,,,,,,,,,,,,,,,,,,,,,,,,,,,,,,,,,,,,,,,
51,New Skills New Start,Ceredigion County Council,SY23 3UE,,"Our programme helps individuals explore self-employment, training, volunteering and employment.",,,"£231,030 ",1,#N/A,#N/A,2,3,23,8,,,,,,,,,,,,,,,,,,,,,,"£231,030 ",,,,,,,,,,,,,,,,,,,,,,,,,,,,,,,,,,,,,,,,,,,,,,,,,,,,,,,,,,,,,,,,,,,,,,,,,,,,,,,,,,,,,,,,,,,,,,,,,,,,,,,,,,,,,,,,,,,,,,,,,,,,,,,,,,,,,,,,,,,,,,,,,,,,,,,,,,,,,,,,,,,,,,,,,,,,,,,,,,,,,,,
52,Reverb,Ceredigion County Council,SY23 3UE,,"Part of a wider Youth Café project, which hopes to pilot a training and employment scheme which will be offered to currently economically inactive, unemployable young people from their client group, enabling them to gain skills and experience within a safe supported environment.",,,"£75,212 ",1,#N/A,#N/A,2,2,23,8,,,,,,,,,,,,,,,,,,,,,,"£75,212 ",,,,,,,,,,,,,,,,,,,,,,,,,,,,,,,,,,,,,,,,,,,,,,,,,,,,,,,,,,,,,,,,,,,,,,,,,,,,,,,,,,,,,,,,,,,,,,,,,,,,,,,,,,,,,,,,,,,,,,,,,,,,,,,,,,,,,,,,,,,,,,,,,,,,,,,,,,,,,,,,,,,,,,,,,,,,,,,,,,,,,,,
53,Rural Community Engagement and Outreach Project,Ceredigion County Council,SY23 3UE,,"Enabling individuals to live healthily as possible, improving their independence, resilience nand autonomy, supporting them into sustainable employment, training and or education.",,,"£51,000 ",1,#N/A,#N/A,2,3,23,8,,,,,,,,,,,,,,,,,,,,,,"£51,000 ",,,,,,,,,,,,,,,,,,,,,,,,,,,,,,,,,,,,,,,,,,,,,,,,,,,,,,,,,,,,,,,,,,,,,,,,,,,,,,,,,,,,,,,,,,,,,,,,,,,,,,,,,,,,,,,,,,,,,,,,,,,,,,,,,,,,,,,,,,,,,,,,,,,,,,,,,,,,,,,,,,,,,,,,,,,,,,,,,,,,,,,Assume only Ceredigion
54,Conwy Skills & Employability Programme for Recovery and Growth,Conwy County Borough Council,LL29 7AZ,,"A series of Pilot projects which includes Pre-employment support, therapeutic counselling for those with mental health barriers to employment, action learning research to evaluate impact of pilot, pathway and development training courses in priority sectors and a feasibility study to identify model to establish multi-agency digital inclusion group in the community. Aimed at helping and supporting people to overcome multiple barriers to employment, with a person-centred strengths-based approach, helping them with job searches or short courses to help get them back into work. ",,,"£270,893 ",1,#N/A,#N/A,2,2,23,2,,,,,,,,,,,,,,,,,,,,,,"£270,893 ",,,,,,,,,,,,,,,,,,,,,,,,,,,,,,,,,,,,,,,,,,,,,,,,,,,,,,,,,,,,,,,,,,,,,,,,,,,,,,,,,,,,,,,,,,,,,,,,,,,,,,,,,,,,,,,,,,,,,,,,,,,,,,,,,,,,,,,,,,,,,,,,,,,,,,,,,,,,,,,,,,,,,,,,,,,,,,,,,,,,,,,
55,Conwy Tourism Innovation Hub,Conwy County Borough Council,LL29 7AZ,,"The project involves a series of initiatives to create and apply innovation in the town's vibrant tourism industry & visitor economy.  The aim of the project is to help build business resilience, improve efficiency and create a competitive edge for organisations within the town. Businesses should be able to benefit individually as well as working in collaboration to develop a capacity for growth.",,,"£850,093 ",1,#N/A,#N/A,3,2,23,,,,,,,,,,,,,,,,,,,,,,,,,,,,,,,,,,,,,,,,,,,,,Conwy,,,,,,,,,,,,,,,,,,,,,,,,,,,,,,,,,,,,,,,,,,,,,,,,,,LL32 8,,,,,,,,,,,,,,,,,,,,,,,,,,,,,,,,,,,,,,,,,,,,,,,,,,850093,,,,,,,,,,,,,,,,,,,,,,,,,,,,,,,,,,,,,,,,,,,,,,,,,,,,,,,,,,,,,
56,Creating opportunities for Culture-led renewal: Conwy Culture Strategy Development,Conwy County Borough Council,LL29 7AZ,,"To create a Cultural Partnership Enterprise to provide overall leadership and co-ordination of the Culture Strategy and five Town Teams to oversee spotlight action plans for our main towns. Also, to develop a Cultural Venture Fund and culture-led community place making.  The project includes two feasibility studies; the first will look at opportunities for increasing the use of Welsh words/Welsh language to enhance the visitor welcome and create a more authentic visitor experience. The second will audit and make recommendations on culture-for-wellbeing projects to progress under the Creu Conwy strategy.",,,"£219,842 ",1,#N/A,#N/A,2,2,23,2,,,,,,,,,,,,,,,,,,,,,,"£219,842 ",,,,,,,,,,,,,,,,,,,,,,,,,,,,,,,,,,,,,,,,,,,,,,,,,,,,,,,,,,,,,,,,,,,,,,,,,,,,,,,,,,,,,,,,,,,,,,,,,,,,,,,,,,,,,,,,,,,,,,,,,,,,,,,,,,,,,,,,,,,,,,,,,,,,,,,,,,,,,,,,,,,,,,,,,,,,,,,,,,,,,,,
57,Digital and Creative Conwy,Conwy County Borough Council,LL29 7AZ,,"The proposal is for a skills academy and business accelerator, to provide potential employees with a variety of workshops and interactive sessions. It includes digital reviews for businesses, and overviews of Net Zero plans and reviews measuring industry footprint with research from Bangor University providing carbon road mapping and toolkits for businesses.",,,"£442,900 ",1,#N/A,#N/A,2,2,23,2,,,,,,,,,,,,,,,,,,,,,,"£442,900 ",,,,,,,,,,,,,,,,,,,,,,,,,,,,,,,,,,,,,,,,,,,,,,,,,,,,,,,,,,,,,,,,,,,,,,,,,,,,,,,,,,,,,,,,,,,,,,,,,,,,,,,,,,,,,,,,,,,,,,,,,,,,,,,,,,,,,,,,,,,,,,,,,,,,,,,,,,,,,,,,,,,,,,,,,,,,,,,,,,,,,,,
58,Digital support platforms for businesses and communities in Conwy,Conwy County Borough Council,LL29 7AZ,,"Develop a series of online tools available to business sectors and local communities, supporting economic recovery and development.  Two workstreams: Customer Relationship Management Database and Directory; Tourism Ambassador Programme development, additional modules covering employment in tourism, customer service, green sustainable tourism and visitor safety in the mountains and on sea.",,,"£75,480 ",1,#N/A,#N/A,2,2,23,2,,,,,,,,,,,,,,,,,,,,,,"£75,480 ",,,,,,,,,,,,,,,,,,,,,,,,,,,,,,,,,,,,,,,,,,,,,,,,,,,,,,,,,,,,,,,,,,,,,,,,,,,,,,,,,,,,,,,,,,,,,,,,,,,,,,,,,,,,,,,,,,,,,,,,,,,,,,,,,,,,,,,,,,,,,,,,,,,,,,,,,,,,,,,,,,,,,,,,,,,,,,,,,,,,,,,
59,Llandudno Bay Promenade enhancement,Conwy County Borough Council,LL29 7AZ,,This is the first stage of the renewal and redesign of the heritage shelters and colonnades on Llandudno North Shore. The project will design replacement shelters and an upgrade of the colonnades to provide innovative new services to visitors and the local community.,,,"£51,000 ",1,#N/A,#N/A,3,3,25,,,,,,,,,,,,,,,,,,,,,,,,,,,,,,,,,,,,,,,,,,,,,Llandudno,Llandudno,,,,,,,,,,,,,,,,,,,,,,,,,,,,,,,,,,,,,,,,,,,,,,,,,LL30 1,LL30 3,,,,,,,,,,,,,,,,,,,,,,,,,,,,,,,,,,,,,,,,,,,,,,,,,25500,25500,,,,,,,,,,,,,,,,,,,,,,,,,,,,,,,,,,,,,,,,,,,,,,,,,,,,,,,,,,,,
60,Research on the impact of Covid19 on our town Centres,Conwy County Borough Council,LL29 7AZ,,"The project will deliver an appraisal of the current state of the 12 town and district centres in Conwy County Borough which will capture not just the lasting impacts of the COVID19 pandemic, but also recognise pre-pandemic longer term trends. This project will commission a study to specifically look at: understanding the impact of future working patterns, and impacts on town centres including the knock-on effects on footfall, spend, home working and the need for town centre co-working office hubs. The impact of the above on demand for office space, residential, tenanted workspace, property and land.  This will also include the development of a Motorhome strategy for Conwy. ",,,"£91,800 ",1,#N/A,#N/A,2,2,23,2,,,,,,,,,,,,,,,,,,,,,,"£91,800 ",,,,,,,,,,,,,,,,,,,,,,,,,,,,,,,,,,,,,,,,,,,,,,,,,,,,,,,,,,,,,,,,,,,,,,,,,,,,,,,,,,,,,,,,,,,,,,,,,,,,,,,,,,,,,,,,,,,,,,,,,,,,,,,,,,,,,,,,,,,,,,,,,,,,,,,,,,,,,,,,,,,,,,,,,,,,,,,,,,,,,,,
61,Rural Conwy Community Support and Development,Conwy County Borough Council,LL29 7AZ,,To expand on the work of the already established Rural team to: enable and support the governance of Town and Community Councils; expand the Transport for the Community scheme; feasibility for small scale renewable energy generation; support rollout of fibre broadband to rural areas of Conwy.,,,"£141,287 ",1,#N/A,#N/A,2,3,23,2,,,,,,,,,,,,,,,,,,,,,,"£141,287 ",,,,,,,,,,,,,,,,,,,,,,,,,,,,,,,,,,,,,,,,,,,,,,,,,,,,,,,,,,,,,,,,,,,,,,,,,,,,,,,,,,,,,,,,,,,,,,,,,,,,,,,,,,,,,,,,,,,,,,,,,,,,,,,,,,,,,,,,,,,,,,,,,,,,,,,,,,,,,,,,,,,,,,,,,,,,,,,,,,,,,,,
62,Towyn & Kinmel Bay Community Connections Project,Conwy County Borough Council,LL29 7AZ,,To establish a Community Partnership for Towyn and Kinmel Bay. The aim of the Partnership will be to gather evidence and work to understand the issues facing the community; talk to the community about assets and challenges within the area and identify actions to address these; agree priorities the community needs to make them happen and develop an action toolkit that upskills the community with co-delivery.,,,"£63,507 ",1,#N/A,#N/A,3,2,23,,,,,,,,,,,,,,,,,,,,,,,,,,,,,,,,,,,,,,,,,,,,,Towyn,Kinmel Bay,,,,,,,,,,,,,,,,,,,,,,,,,,,,,,,,,,,,,,,,,,,,,,,,,LL29 9,LL18 2,,,,,,,,,,,,,,,,,,,,,,,,,,,,,,,,,,,,,,,,,,,,,,,,,31753.5,31753.5,,,,,,,,,,,,,,,,,,,,,,,,,,,,,,,,,,,,,,,,,,,,,,,,,,,,,,,,,,,,
63,Transforming Young Minds for Tomorrow - Trawsnewid Meddyliau Ifanc ar gyfer Yfory,Conwy County Borough Council,LL29 7AZ,,"The project would create interactive activities to expose both primary and secondary school pupils to the wonders of manufacturing and engineering. Making them aware of the range of innovative and rewarding careers available in the Advanced Materials and Manufacturing, Creative and Digital and Energy and Environment sectors in the region.",,,"£88,614 ",1,#N/A,#N/A,2,3,21,2,,,,,,,,,,,,,,,,,,,,,,"£88,614 ",,,,,,,,,,,,,,,,,,,,,,,,,,,,,,,,,,,,,,,,,,,,,,,,,,,,,,,,,,,,,,,,,,,,,,,,,,,,,,,,,,,,,,,,,,,,,,,,,,,,,,,,,,,,,,,,,,,,,,,,,,,,,,,,,,,,,,,,,,,,,,,,,,,,,,,,,,,,,,,,,,,,,,,,,,,,,,,,,,,,,,,
64,Blossom & Bloom - Community Outreach,Denbighshire County Council,LL15 1YN,,Blossom and Bloom will deliver well-being and housing related support to all mums and babies in Rhyl who have any kind of support need. This is a pilot outreach service building upon current service provision. They will also employ a tenancy coordinator to help create more sustainable housing opportunities for the mothers.,,,"£102,719 ",1,#N/A,#N/A,3,2,14,,,,,,,,,,,,,,,,,,,,,,,,,,,,,,,,,,,,,,,,,,,,,Rhyl,Rhyl,Rhyl,Rhyl,,,,,,,,,,,,,,,,,,,,,,,,,,,,,,,,,,,,,,,,,,,,,,,LL18 1,LL18 2,LL18 3,LL18 4,,,,,,,,,,,,,,,,,,,,,,,,,,,,,,,,,,,,,,,,,,,,,,,25679.69,25679.69,25679.69,25679.69,,,,,,,,,,,,,,,,,,,,,,,,,,,,,,,,,,,,,,,,,,,,,,,,,,,,,,,,,,
65,Cam Ymlaen / Step Forward (Pilot) - Take that step forward to employment,Denbighshire County Council,LL15 1YN,,An intensive and holistic programme to help young people be ready for both employment and living independently. There will be a strong focus on well-being and mental health throughout the project.,,,"£40,464 ",1,#N/A,#N/A,2,3,23,4,,,,,,,,,,,,,,,,,,,,,,"£40,464 ",,,,,,,,,,,,,,,,,,,,,,,,,,,,,,,,,,,,,,,,,,,,,,,,,,,,,,,,,,,,,,,,,,,,,,,,,,,,,,,,,,,,,,,,,,,,,,,,,,,,,,,,,,,,,,,,,,,,,,,,,,,,,,,,,,,,,,,,,,,,,,,,,,,,,,,,,,,,,,,,,,,,,,,,,,,,,,,,,,,,,,,Assume only Denbighshire
66,Community Innovation Denbighshire,Denbighshire County Council,LL15 1YN,,"Cadwyn Clwyd will work with clusters of community and businesses enabling them to undertake pilot projects and feasibility studies. They will also provide a Business innovation grant. DVSC (external website) will pilot the re-purposing of a historical building as an innovative market place which focuses on reducing food waste, well-being and enterprise.",,,"£554,749 ",1,#N/A,#N/A,2,2,21,4,,,,,,,,,,,,,,,,,,,,,,"£554,749 ",,,,,,,,,,,,,,,,,,,,,,,,,,,,,,,,,,,,,,,,,,,,,,,,,,,,,,,,,,,,,,,,,,,,,,,,,,,,,,,,,,,,,,,,,,,,,,,,,,,,,,,,,,,,,,,,,,,,,,,,,,,,,,,,,,,,,,,,,,,,,,,,,,,,,,,,,,,,,,,,,,,,,,,,,,,,,,,,,,,,,,,
67,Cowork Local (Denbighshire),Denbighshire County Council,LL15 1YN,,To create and promote an online platform which will enable the development of co-working spaces across Denbighshire. This will allow hosts to simply advertise their spaces to potential co-workers and will make it simply for co-workers to book into spaces.,,,"£489,549 ",1,#N/A,#N/A,2,3,20,4,,,,,,,,,,,,,,,,,,,,,,"£489,549 ",,,,,,,,,,,,,,,,,,,,,,,,,,,,,,,,,,,,,,,,,,,,,,,,,,,,,,,,,,,,,,,,,,,,,,,,,,,,,,,,,,,,,,,,,,,,,,,,,,,,,,,,,,,,,,,,,,,,,,,,,,,,,,,,,,,,,,,,,,,,,,,,,,,,,,,,,,,,,,,,,,,,,,,,,,,,,,,,,,,,,,,
68,Denbighshire STEM Connect,Denbighshire County Council,LL15 1YN,,To prepare the community for the further development of the local economy by increasing skill and interest in anticipated areas of STEM industry growth. The project will work with key employers to develop a range of workshops and will develop a recognised local framework to provide 'STEM ready' certification.,,,"£406,832 ",1,#N/A,#N/A,2,2,23,4,,,,,,,,,,,,,,,,,,,,,,"£406,832 ",,,,,,,,,,,,,,,,,,,,,,,,,,,,,,,,,,,,,,,,,,,,,,,,,,,,,,,,,,,,,,,,,,,,,,,,,,,,,,,,,,,,,,,,,,,,,,,,,,,,,,,,,,,,,,,,,,,,,,,,,,,,,,,,,,,,,,,,,,,,,,,,,,,,,,,,,,,,,,,,,,,,,,,,,,,,,,,,,,,,,,,
69,Digital Manufacturing Support Cymru Programme (DIMAS Programme),Denbighshire County Council,LL15 1YN,,"To provide support to Denbighshire businesses to develop innovation plans that will improve the quality, productivity and performance of local manufacturing. Especially in terms of digitalisation and the reduction of carbon impact in the manufacturing industry (including food and drink).",,,"£629,341 ",1,#N/A,#N/A,2,2,23,4,,,,,,,,,,,,,,,,,,,,,,"£629,341 ",,,,,,,,,,,,,,,,,,,,,,,,,,,,,,,,,,,,,,,,,,,,,,,,,,,,,,,,,,,,,,,,,,,,,,,,,,,,,,,,,,,,,,,,,,,,,,,,,,,,,,,,,,,,,,,,,,,,,,,,,,,,,,,,,,,,,,,,,,,,,,,,,,,,,,,,,,,,,,,,,,,,,,,,,,,,,,,,,,,,,,,
70,Economic Empowerment Project,Denbighshire County Council,LL15 1YN,,"The Economic Empowerment project will provide support to residents who are looking at starting something new, by providing advice and guidance about the industry and how to utilize the skills they already have.",,,"£113,387 ",1,#N/A,#N/A,2,3,23,4,,,,,,,,,,,,,,,,,,,,,,"£113,387 ",,,,,,,,,,,,,,,,,,,,,,,,,,,,,,,,,,,,,,,,,,,,,,,,,,,,,,,,,,,,,,,,,,,,,,,,,,,,,,,,,,,,,,,,,,,,,,,,,,,,,,,,,,,,,,,,,,,,,,,,,,,,,,,,,,,,,,,,,,,,,,,,,,,,,,,,,,,,,,,,,,,,,,,,,,,,,,,,,,,,,,,Unclear information on visibility
71,Employability Skills,Denbighshire County Council,LL15 1YN,,"To offer a series of 12hr courses for economically inactive adults and those furthest away from the workplace, to increase their chances of getting and keeping employment. The project uses drama techniques to connect with individuals, boost confidence and widen aspirations.",,,"£10,200 ",1,#N/A,#N/A,2,2,23,4,,,,,,,,,,,,,,,,,,,,,,"£10,200 ",,,,,,,,,,,,,,,,,,,,,,,,,,,,,,,,,,,,,,,,,,,,,,,,,,,,,,,,,,,,,,,,,,,,,,,,,,,,,,,,,,,,,,,,,,,,,,,,,,,,,,,,,,,,,,,,,,,,,,,,,,,,,,,,,,,,,,,,,,,,,,,,,,,,,,,,,,,,,,,,,,,,,,,,,,,,,,,,,,,,,,,Assume only Denbighshire
72,Feasibility Study of a multi-vector Smart Local Energy System in Denbighshire County,Denbighshire County Council,LL15 1YN,,To assess the feasibility of multi-vector Smart Local Energy Schemes for the local authority area. The recommendations resulting from the feasibility study and delivery plan will form part of the business case development process for the Growth Deal's Smart Local Energy Project.,,,"£96,900 ",1,#N/A,#N/A,2,2,23,4,,,,,,,,,,,,,,,,,,,,,,"£96,900 ",,,,,,,,,,,,,,,,,,,,,,,,,,,,,,,,,,,,,,,,,,,,,,,,,,,,,,,,,,,,,,,,,,,,,,,,,,,,,,,,,,,,,,,,,,,,,,,,,,,,,,,,,,,,,,,,,,,,,,,,,,,,,,,,,,,,,,,,,,,,,,,,,,,,,,,,,,,,,,,,,,,,,,,,,,,,,,,,,,,,,,,
73,Not Being Left Out,Denbighshire County Council,LL15 1YN,,"To offer mentoring support for young people furthest away from the jobs market and their family. The project takes a person centred approach and provides practical support. Participants will gain access to training, work clubs, and support with their health and wellbeing.",,,"£10,324 ",1,#N/A,#N/A,2,2,23,4,,,,,,,,,,,,,,,,,,,,,,"£10,324 ",,,,,,,,,,,,,,,,,,,,,,,,,,,,,,,,,,,,,,,,,,,,,,,,,,,,,,,,,,,,,,,,,,,,,,,,,,,,,,,,,,,,,,,,,,,,,,,,,,,,,,,,,,,,,,,,,,,,,,,,,,,,,,,,,,,,,,,,,,,,,,,,,,,,,,,,,,,,,,,,,,,,,,,,,,,,,,,,,,,,,,,
74,Pixel Engagement Programme,Denbighshire County Council,LL15 1YN,,"To provide a holistic tailored programme of activities and skills building for young people who are at risk of disengaging from education/training or who are already not in employment, education or training (NEET).",,,"£109,133 ",1,#N/A,#N/A,2,2,23,4,,,,,,,,,,,,,,,,,,,,,,"£109,133 ",,,,,,,,,,,,,,,,,,,,,,,,,,,,,,,,,,,,,,,,,,,,,,,,,,,,,,,,,,,,,,,,,,,,,,,,,,,,,,,,,,,,,,,,,,,,,,,,,,,,,,,,,,,,,,,,,,,,,,,,,,,,,,,,,,,,,,,,,,,,,,,,,,,,,,,,,,,,,,,,,,,,,,,,,,,,,,,,,,,,,,,
75,READY,Denbighshire County Council,LL15 1YN,,"The project will establish a multi-agency team to join up a variety of services around individuals aged 16-35 to address the variety of barriers to employment, raise aspiration, increase motivation and engagement with the labour market or the mainstream DWP employment programmes.",,,"£168,306 ",1,#N/A,#N/A,2,3,23,4,,,,,,,,,,,,,,,,,,,,,,"£168,306 ",,,,,,,,,,,,,,,,,,,,,,,,,,,,,,,,,,,,,,,,,,,,,,,,,,,,,,,,,,,,,,,,,,,,,,,,,,,,,,,,,,,,,,,,,,,,,,,,,,,,,,,,,,,,,,,,,,,,,,,,,,,,,,,,,,,,,,,,,,,,,,,,,,,,,,,,,,,,,,,,,,,,,,,,,,,,,,,,,,,,,,,
76,Transforming Young Minds for Tomorrow - Trawsnewid Meddyliau Ifanc ar gyfer Yfory,Denbighshire County Council,LL15 1YN,,"The project would create interactive activities to expose both primary and secondary school pupils to the wonders of manufacturing and engineering. Making them aware of the range of innovative and rewarding careers available in the Advanced Materials and Manufacturing, Creative and Digital and Energy and Environment sectors in the region.",,,"£88,614 ",1,#N/A,#N/A,2,3,21,4,,,,,,,,,,,,,,,,,,,,,,"£88,614 ",,,,,,,,,,,,,,,,,,,,,,,,,,,,,,,,,,,,,,,,,,,,,,,,,,,,,,,,,,,,,,,,,,,,,,,,,,,,,,,,,,,,,,,,,,,,,,,,,,,,,,,,,,,,,,,,,,,,,,,,,,,,,,,,,,,,,,,,,,,,,,,,,,,,,,,,,,,,,,,,,,,,,,,,,,,,,,,,,,,,,,,
77,Y TÅ· Gwyrdd,Denbighshire County Council,LL15 1YN,,"To trial the delivery of community workshops, events and activities that focus on well-being (particularly covid-19 related), environment and sustainability, and arts and culture – a calendar of events custom designed and delivered to meet the requirements of the local community, with a strong emphasis on collaboration.",,,"£69,691 ",1,#N/A,#N/A,2,3,23,4,,,,,,,,,,,,,,,,,,,,,,"£69,691 ",,,,,,,,,,,,,,,,,,,,,,,,,,,,,,,,,,,,,,,,,,,,,,,,,,,,,,,,,,,,,,,,,,,,,,,,,,,,,,,,,,,,,,,,,,,,,,,,,,,,,,,,,,,,,,,,,,,,,,,,,,,,,,,,,,,,,,,,,,,,,,,,,,,,,,,,,,,,,,,,,,,,,,,,,,,,,,,,,,,,,,,
78,Digital Gwynedd,Gwynedd Council,LL55 1SH,,"Project by Citizens Online to support adults with the essential digital skills for life focusing on supporting people with employment related digital skills, especially older people that have been made redundant during the pandemic.",,,"£157,993 ",1,#N/A,#N/A,2,2,23,3,,,,,,,,,,,,,,,,,,,,,,"£157,993 ",,,,,,,,,,,,,,,,,,,,,,,,,,,,,,,,,,,,,,,,,,,,,,,,,,,,,,,,,,,,,,,,,,,,,,,,,,,,,,,,,,,,,,,,,,,,,,,,,,,,,,,,,,,,,,,,,,,,,,,,,,,,,,,,,,,,,,,,,,,,,,,,,,,,,,,,,,,,,,,,,,,,,,,,,,,,,,,,,,,,,,,
79,Enterprising Communities,Gwynedd Council,LL55 1SH,,Project by Gwynedd Council to empower local communities through area regeneration plans and build areas’ capacity to shape their future via training and practical support.,,,"£463,203 ",1,#N/A,#N/A,2,3,23,3,,,,,,,,,,,,,,,,,,,,,,"£463,203 ",,,,,,,,,,,,,,,,,,,,,,,,,,,,,,,,,,,,,,,,,,,,,,,,,,,,,,,,,,,,,,,,,,,,,,,,,,,,,,,,,,,,,,,,,,,,,,,,,,,,,,,,,,,,,,,,,,,,,,,,,,,,,,,,,,,,,,,,,,,,,,,,,,,,,,,,,,,,,,,,,,,,,,,,,,,,,,,,,,,,,,,
80,Feasibility Study of a multi-vector Smart Local Energy System in Gwynedd County,Gwynedd Council,LL55 1SH,,To assess the feasibility of multi-vector Smart Local Energy Schemes for the local authority area. The recommendations resulting from the feasibility study and delivery plan will form part of the business case development process for the Growth Deal's Smart Local Energy Project.,,,"£107,100 ",1,#N/A,#N/A,2,2,23,3,,,,,,,,,,,,,,,,,,,,,,"£107,100 ",,,,,,,,,,,,,,,,,,,,,,,,,,,,,,,,,,,,,,,,,,,,,,,,,,,,,,,,,,,,,,,,,,,,,,,,,,,,,,,,,,,,,,,,,,,,,,,,,,,,,,,,,,,,,,,,,,,,,,,,,,,,,,,,,,,,,,,,,,,,,,,,,,,,,,,,,,,,,,,,,,,,,,,,,,,,,,,,,,,,,,,
81,Gwynedd Digital and Net Zero Business Academy,Gwynedd Council,LL55 1SH,,"Project by Grŵp Llandrillo Menai which aims to support micro and small businesses to understand and improve their digital and net zero capabilities. A tailored, one to one consultancy service will be provided to eligible businesses to support their aspirations.",,,"£340,077 ",1,#N/A,#N/A,2,2,23,3,,,,,,,,,,,,,,,,,,,,,,"£340,077 ",,,,,,,,,,,,,,,,,,,,,,,,,,,,,,,,,,,,,,,,,,,,,,,,,,,,,,,,,,,,,,,,,,,,,,,,,,,,,,,,,,,,,,,,,,,,,,,,,,,,,,,,,,,,,,,,,,,,,,,,,,,,,,,,,,,,,,,,,,,,,,,,,,,,,,,,,,,,,,,,,,,,,,,,,,,,,,,,,,,,,,,
82,Llwybrau Mawddwy Cymru [Mawddwy Trails Wales],Gwynedd Council,LL55 1SH,,"Project by Cwmni Nod Glas Cyf. to support the realisation of an ambitious programme to improve local circular trails maximising the employment, experience, upskilling and environmental benefits to local communities.",,,"£45,900 ",1,#N/A,#N/A,2,3,23,3,,,,,,,,,,,,,,,,,,,,,,"£45,900 ",,,,,,,,,,,,,,,,,,,,,,,,,,,,,,,,,,,,,,,,,,,,,,,,,,,,,,,,,,,,,,,,,,,,,,,,,,,,,,,,,,,,,,,,,,,,,,,,,,,,,,,,,,,,,,,,,,,,,,,,,,,,,,,,,,,,,,,,,,,,,,,,,,,,,,,,,,,,,,,,,,,,,,,,,,,,,,,,,,,,,,,"No details on postcodes for project, but cover a large area"
